title,content,created
"Mysterious flashes turning night into day, powerful lights that signaled my team from a remote ridge line &amp; a vehicle shook violently as it was being driven away from our research site.All this and more are described in this detailed report from the Contact Underground.","[View of the Western San Fernando Valley from the Santa Susana Pass](https://preview.redd.it/1o2qvkae7c2h1.jpg?width=275&amp;format=pjpg&amp;auto=webp&amp;s=999afd1a24f5927d22b992a527dd91eafd1629bc)

**Mystery Lights in the Santa Susana Pass** 

**September 4, 1992**

 The newly formed CSETI Los Angeles Working Group held a brief meeting at Drs. Eve and Dave Gordon’s home in a middle-class neighborhood in the San Fernando Valley. Twelve researchers were present. From the Gordons’ we drove north in our separate vehicles and reconvened at the head of the trail that lead to our research site in the Santa Susana Pass. It was late when we arrived, 10:30 PM on a Friday night. Most of the Working Group investigators present had already put in a full day’s work at their regular jobs. I was gratified to find that the enthusiasm of the team was quite high.

**OUR RANKS WERE THINNED**

Our numbers however had considerably decreased from the first outing a week before. On that occasion 40 prospective UFO investigators had trudged up the high desert trail which led to a spectacular lookout point. It was there that CSETI Director, Dr. Steven Greer, had demonstrated the “ET contact protocols.” One causality from that first night of fieldwork involved a heavy-set woman who had twisted her ankle on the dark rocky trail. She would never go out with our team again. 

There had been other problems as well. One researcher/trainee, in violation of the contact protocols, brought a 15-year-old boy with her. She claimed that his “parents wouldn’t mind” his doing UFO field work. In the early days of the CE-5 Initiative, Working Group participation was almost exclusively limited to consenting adults who have undergone training. Since no special arrangements had been made with the boy’s legal guardians to allow him to participate, this teenager was advised not to come back.  Other individuals had dropped out because the reality of contact work didn’t quite fit their preconceived notions. Some complained after going out into the field that, “it was too cold,” or “it was too windy, ...... and “anyway the spaceships didn’t show up.”

This second night of fieldwork was very different from our first attempt at contacting what we imagined was extraterrestrial intelligence. Not only were we far fewer in number, but more importantly we were going out without the assistance of Dr. Steven Greer. He was already being described in the UFO community as, “The man who can call in the spacecraft.” I wondered if we could ever make contact without his presence. I feared my inexperienced leadership wouldn’t “cut the mustard” when it came to what Greer called “vectoring in spacecraft.” 

**HAVING A “SAFE AREA” WAS PART OF THE CONTACT PROTOCOLS**

During the 20-minute climb up the trail, we found a quiet place that we designated as our “safe area”. Finding such a place was part of the usual fieldwork protocols. If Working Group members became frightened during a close encounter, they could be escorted to the “safe area” by a “buddy “to “cool off.” Our “safe area” was selected just over the ridge that separated our sky watch site from the 118 Freeway. From this safety zone any frightened individual could securely look down to the road where our vehicles were parked.  Steven Greer had emphasized the importance of having a compassionate attitude towards coworkers who become frightened during contact work.  Let’s face it, we are just human and individuals can get overwhelmed by some of the bizarre manifestations of non-human intelligence.  Little did we know when selecting the site, that this designated “cooling off zone” would be the very place where a strange interactive experience would later ensue.

**A FORM OF THOUGHT PROJECTION WAS EMPLOYED**

At a 11 PM we reached our research site. Under slightly overcast skies we set up our folding aluminum chairs. While sitting quietly in a tight circle, we started a guided meditation. The technique that we had learned from Dr. Greer is called, “Coherent Thought Sequencing” or “CTS” for short. It involves thought projection and visualizations.  To be effective, according to Dr. Greer, it requires reaching some appreciation of the unbounded aspects of consciousness. “Unbounded” means in this context the quality of consciousness or mind that is not limited by any measure of time and space. This document can not provide a detailed description of Coherent Though Sequencing. Both the theory and practice of CTS had been the focus of much of our all day CSETI seminar held just 6 days before.

**NIGHT WAS TURNED INTO DAY**

As we sat there under slightly overcast skies in quiet meditation, suddenly a powerful burst of light struck the contact team. My eyes were closed at the time, nevertheless the light was so intense that my entire visual field flashed white. Several members of the group sat up in surprise and opened their eyes to see what was going on. Those who had experienced the burst of light with eyes open, agreed that it was lightning like. The light appeared to have emanated from the southeast. Strangely there was no associated thunder with this brilliant flash, nor was there any storm activity in the area. The light had virtually turned night into day. The next instant it was gone. We found ourselves sitting in the darkness again listening to the gentle sounds of nature. During the next few minutes as we attempted to resume CTS, the flashes hit us several more times. There was no rain in our vicinity, nor was it particularly humid. Not one researcher could ever recall having witnessed such a strange event.  This occurrence did not correspond to any type of known atmospheric phenomenon. I personally have not witnessed anything quite like it since.

**IT IS BETTER NOT TO HIKE ALONE IN REMOTE LOCATIONS**

For several hours we alternated quiet meditation with sky watch activities. We signaled toward the partially overcast sky with powerful lights. At approximately 1:00 AM Saturday morning September 5th, a few members of the team took leave of the site. It was quite isolated. For safety purposes we hiked down to the vehicles in small groups. There are important historic reasons to be security conscious in this rather lonely place. Our site was less than a mile from the Box Canyon, home of the murderous Charles Manson clan. They had been responsible for a number of grisly murders some 20 years before. During the 1990s the Los Angeles area was even more dangerous. We therefore deemed it wise not to hike alone on the lonely mountain trail.

**A CO-WORKER FROM THE MEDICAL CENTER WAS ON OUR CONTACT TEAM**

Shirley Jones, a respiratory technician from my hospital, was among those departing early. She had to get up for a 7AM shift that very same morning. Not being much of a night person, she was eager to get home. Shirley and I had already worked together at the hospital for over 13 years when we discovered we had a mutual interest in UFOs.  Although well into middle age, Shirley easily passed for a woman 10 or 15 years her junior. She was blond with deep blue eyes. Shirley was quite fun loving and sported a broad smile. She walked with a kind of a bounce that looked a little like skipping. Over the years I always enjoyed working with her. In the ER she was known for her gentleness in reassuring panicky respiratory patients who were struggling to catch a breath.

Apparently by chance Shirley and I discovered our common interest in UFOs. My interest in the flying saucer phenomenon dates to December of 1990, when for no particular reason I picked up a book titled “The Gulf Breeze Sightings.” It contained strikingly clear photos that were purported to be of ET spacecraft. Curious I read more. After quietly studying the phenomenon for a year and a half, I summoned up the courage to attend my first public UFO meeting. That was my first mistake.

At the UFO Expo West held in May of 1992, I wandered into Dr. Greer’s workshop. Well aware of how conservative the medical field was and not wanting to be identified as a “UFO nut”, I felt somewhat apprehensive about being seen at such a gathering. I figured however that since Dr.  Greer and I were both Emergency Room physicians, there would be little harm in attending his workshop. I was very surprised to walk in and find Shirley sitting front row center. She wickedly pointed her finger at me, and laughingly teased, “Dr. Burkes I didn’t know yooouuu were interested in UFOs.” I looked around the room quickly to see if anyone else from the hospital was present. To my relief I found none. I hoped Shirley could keep my presence at a UFO meeting as “our little secret.”  Shirley’s interest in UFOs, unlike mine, had been long-standing. I soon discovered that she was a skilled meditator and knowledgeable in Eastern philosophy. Shirley later told me that she had a Ph.D. in psychology and did counseling part time. Among her patients were “experiencers” of Close Encounters of the Third and Fourth Kinds. She did all this while working full time as a respiratory therapist at our medical center. Oh yes, I almost forgot to mention that she was also a professional photographer Shirley had a small business doing portraits and covering weddings. All these talents would later be put to good use during CE-5 Working Group research activities.

Now let’s return to our September 4-5 night’s research outing. As you might recall, I was flying solo as Working Group Coordinator. The only other times I had gone out into the field was either with Steven Greer, or with other experienced volunteer contact workers. I was doing my darndest to effectively lead a group composed of people who for the most part had just started working together. It was well past midnight when decided to break camp and call it a night. When small groups of researchers including Shirley began leaving the site separately, I became concerned. I imagined that it would be better if we all left together.  This was in order to maintain the group’s cohesiveness as well as for security purposes. Shirley reached her car at about 1:30 AM. She drove southeast across the San Fernando Valley towards Panorama City where she lived. Little did she know what was about to happen to her and the rest of the team. In just a few short moments we would experience something that can only be characterized as very “high strangeness.”

Those of us still at the site packed up our gear headed down the trail about a half an hour behind the others. Tired and a little cold, we moved slowly in the dark. We did not want to trip and fall on the way down.  As I reached the top of the hill that separated us from the Santa Susana Pass, I looked back for a moment to the south. The view of the San Fernando Valley was truly spectacular. Before me was a sea of twinkling lights. Across an enormous grid like display formed by home and streetlights, an occasional slowly moving car could be seen in the distance. The panorama spanned some 10 miles, all the way to the Santa Monica Mountains to the south. I felt a sense of accomplishment. Although I had never done this type of UFO research before, I realized that in a certain sense I had successfully passed my first leadership test.

Despite whatever doubts and insecurities I might have, I was becoming a contact team leader.

Of course, I had ambitiously hoped for a major sighting of a structured craft. Like everyone else I wanted to see a “real UFO.” If that were my only measure of success, then this first night’s outing was somewhat disappointing. On the other hand, those lightning-like flashes were something out of the ordinary.  I wondered if our efforts would eventually be successful. Would we ever really establish contact with “ETI”?  I would just have to be patient and wait to see what would happen next.

Moving cautiously in the dark, I found my way down the steep trail.  I soon noticed that several members of the team had stopped in front of me. They had reached the “safety” area and were looking intently to the north, towards Rock Peak State Park. About a third of a mile away and perhaps 300 feet above us, we saw two powerful lights. They were perched high up on the ridgeline of the steep hill that bordered north side of the 118 Freeway. 

**MISTERY LIGHTS SIGNALED AT US** 

“Hello”, I thought, “This is very strange.” How could someone get way up there on that deserted hillside?  And what were they doing there at 1:45 in the morning?  No houses or roads were visible anywhere near that ridge. Who could possibly be up there?

The lights seemed much larger than our signal lanterns. They were almost the size of searchlights, about one to two feet across. The one on the left was perched higher up on the mountainside than the one on the right. Less than 100 feet separated them. The light on the right side was directed somewhat away from us. It was pointing downward and to the right, sending its beam across the San Fernando Valley to the southeast.  The direction of its beam was quite significant as we later learned. It was pointing in the exact direction that Shirley had taken as she drove home across the Valley.

As we stared at the lights in wonder, the left one was clearly signaling on and off. Through binoculars we could discern that the right one was shining past a small tree or shrub.  The plant was growing on a tiny ledge jutting out from the steep hillside. This would later enable us to find the exact location where the mysterious lights had been situated. 

 

Angrily I thought,” Who the hell is up there in the middle of the night?” Maybe campers? Or perhaps they were some wild teenagers who were making mischief by mocking us with their lights? Who else but our contact team would be running around in the dark on a Friday night that had now turned into Saturday morning?

I attempted to interact with the lights by signaling back at them. At first, they fired in what appeared to be a random fashion. I couldn’t seem to easily get their attention. During contact work we use the term “photon talk” to describe how we attempt to interact with anomalous lights by signaling back and forth with them. We used a predetermined sequence of flashes. If the object signaled back in the same fashion, then we knew primitive communication has been established. I was hoping to get those strange lights to mimic my pattern of flashes.

**ALEX AYRES’ SUGGESTION WAS EXTREMELY HELPFUL**

Alex Ayres was a member of our team who worked as a screenwriter for the motion picture industry. An avid runner, he was tall with fair skin and athletic. No intellectual lightweight, he told me that he earned a baccalaureate from Harvard University. In addition, he reportedly held two masters’ degrees, one in psychology, \`the other in film writing. 

Earlier that evening at the research site, he had suggested that I might try a more complex pattern of signaling than just one or two flashes at a time. Alex had the idea that if any unknowns would imitate a more complex pattern of light bursts, there would be no doubt that we had established communication. He instructed me to try a series of three bursts, A simple flash, then pause 3 seconds, followed by 2 flashes with another pause of 3 seconds, then ending with 3 more flashes.

As we observed the mystery lights on the hillside, we were able to discern several important details about them. They were not only much larger and more powerful than our halogen battery powered lanterns, but they were also highly sophisticated in their operation. The one on the right was multi-directional. We could see its beam sweep searchlight fashion across the dusty hillside. It smoothly changed its direction several times. We watched in silence. The left one was pointing directly at us. It too demonstrated a number of different functions. This beacon could produce a steady beam as well as a rapid strobe like effect. It could signal on off with tremendous speed. The other light demonstrated a variable rheostat effect as well. In other words, it could flare up in brightness and then decrease its luminosity, gently fading out over several seconds. These were far more complex functions than our primitive signal lanterns were capable of.

The powerful lights used by contact teams in our network were inexpensive, costing only about $50 and could be purchased from mail order houses. My light was called “The Light Bazooka.” It had a simple on-off trigger switch. When extinguished, the light took slightly less than one second to fade out completely. As a former peace activist, I thought it ironic that I was shooting off bursts from my “Light Bazooka” while supposedly trying to peacefully interact with the “ET visitors.” Regardless of the catalogue title, the lights were quite useful. Thus, during fieldwork, I “blasted away” with them for the cause of “interplanetary peace and cooperation.” My primitive “Bazooka” did not vary its fade out time. Once the trigger was released it always required nearly one second to go completely off. In addition, it didn’t have a strobe like function. In military parlance, if my light was the equivalent of a “bazooka” the ones facing us on the ridgeline were about equal to laser guided howitzers.

For several minutes I repeatedly fired my signal lantern at the hillside.  At first, it was to no avail. With simple flashes I couldn’t get any kind of interaction going with whomever or whatever up there on the ridge. I decided to follow Alex’s advice and signal at the mystery lights in the more complex pattern that he had suggested earlier. Then something incredible occurred.  The light on the left that appeared to be pointing directly at us, fired back with a single bright flash. Then suddenly it went silent. I shivered in excitement. Was it waiting for a response from me? I again sent out the pattern of light bursts as Alex had instructed me to do. Flash! I counted, “one one thousand, two one thousand, three one thousand. Flash! Flash!  Then, “one  one thousand, two one thousand, three one thousand, “Flash! Flash! Flash! At that moment something quite remarkable happened. The left light signaled back by exactly mimicking my complex pattern.  My heart started to accelerate. Each time I completed a short phrase of “photon talk” an exact strobe reply flashed back from the hillside. The speed of the response was uncanny. Even before the light had faded from my primitive device, the rapid strobe burst mimicked my signal. Flash! Flash!..Reply! Reply! Three seconds later Flash!  Flash! Flash! Reply! Reply! Reply!

**CONSCIOUSNESS CONNECTION SEEMED LIKELY**

It was very strange indeed. How could someone a few thousand feet away respond with such incredible speed and such perfect timing? It was almost as if my finger on the trigger of the “light bazooka”, was linked to an electronic circuit that produced an instantaneous strobe reply. Later my attempts to accurately reproduce this type of rapid interactive signaling with my contact team coworkers was totally unsuccessful. Our primitive equipment simply could not fire with the same speed and effectiveness as those sophisticated lights that faced us during the morning of September 5^(th), 1992. 

I wondered could this type of precise interaction be evidence of a consciousness link between my team and ETI? That is of course if whoever was signaling at us were extraterrestrials. A proposition I could hardly accept at that time.  Especially since was our first night out as a team.

The CSETI protocols were supposed to prepare us for such interactions with non-human intelligence. But this seemed too much too fast. There had to be another explanation. The uncannily perfect timing of the powerful light signaling back at me made me uneasy. As unlikely as it might seem, I suspected however some kind of consciousness-mediated communication was truly going on.

Our protocols designated such signaling back and forth in an intelligible fashion as “lock on with lights.” The “Center” however did not only use lights. It also trained its researchers in elementary ESP or “psi” techniques. This includes attempts at remote viewing and thought projection. If extrasensory communication between contact team members and ET crews actually occurred, Dr Greer would designate the link as “lock on with consciousness.” For those who think this a wildly radical notion, I can only refer such skeptics to the growing literature documenting the use of applied psi by worldwide military and intelligence services. 

Now back to our September 5, 1992, encounter. Signaling back and forth with individuals unknown is all very well and good. Nevertheless, I had no proof whatsoever at that point that this interaction was with the alleged ETs. After all, we had no sighting of a structured craft hovering in the sky. The lights themselves were not even in the sky, but rather perched on the ridgeline. What kind of self-respecting UFO would signal at us from the ground?  I therefore reasoned it was probably some prankster up there who was playing tricks on us. “A bunch of crazy teenagers having fun on the weekend,” I reasoned.

I thought this despite the totally desolate appearance of the cliff on which the lights were situated. I speculated about the likelihood that there were probably campsites on top of that hill. “Yes of course”, I surmised, “campsites with running water, electricity and a road to bring up the powerful and sophisticated lights.”

All these possibilities went through my mind as we signaled back and forth for several minutes. It was getting late, and my team was already breaking up. Despite Alex’s requests to stay a bit longer and continue the “photon talk,” I was cold and tired. I did not want us to leave the site like a bunch of stragglers, one at a time. I suggested that we call it a night and as a team hike down together. Following this request, the remainder of the Working Group gladly started down the rocky trail to the cars waiting for us on the road below. 

“Tomorrow,” I suggested, “we can send a scout team up to the ledge on the cliff.” It was from there that one light was seen clearly shining past a small tree. We would then know how those “tricksters” had gotten all the necessary equipment up onto the ridge to enable them to “mock” us with those strange lights. After all it was really late. It was time to go home and get some rest!

**SCOUTS HAD TO ROCK CLIMB TO REACH THE REMOTE RIDGE** 

Several days later I ran into Shirley at the hospital. I wanted to tell her about the strange lights and what our scouts had found up on that lonely ridge. They reported that there were no campsites, no running water nor electric power. There was no paved road to provide easy access. The only path up towards the ridge was an old fire trail. And that was situated behind a locked gate that blocked the path of any car that might try to drive up the hill. The entire area was part of Rocky Peak State Park, a protected wilderness that at the time had no facilities whatsoever. It was for day hikers only. To make this point perfectly clear a prominent sign reading “DAY USE ONLY” was posted on the side of the locked gate. 

Thus, our trusty scouts had no easy access to the ridge once they had scaled the hill. They had to rock climb, over rattlesnake infested boulders, to reach the ledge where one of lights was positioned. The solitary dwarf pine tree that clung to the rock face readily identified it. Through its branches we had seen one of the lights shining.  

**SHIRLEY JONES DESCRIBES A HIGH STRANGENESS EVENT**

Before I could finish telling Shirley about our experience and what the scouts had discovered, she interrupted me,

“Wait Joe, I’ve got to tell you what happened to me”

An event of apparent high strangeness had transpired during Shirley’s ride home. It occurred at about 1:40 AM, as she was driving across the San Fernando Valley in her Chevy Astro Van. At a distance of about 2 miles from our research site, she suddenly felt a violent shaking of her vehicle. She had gone over some railroad tracks less than a minute before, but this shaking was definitely far more of a jolt than that. Her van shook violently as if it were going over a series of potholes.  Shirley was aware that I had grown up in New York City where she too had resided for a few years. We both knew how bad the roads were back there. So, I understood exactly what she meant when she added “it was like going over the kind of potholes they have back East.”

The shaking of car her occurred around the same time that the rest of us were hiking down the trail from our research site. As the vibration of her vehicle increased, Shirley jammed on the brakes. She told me that at first, she thought she had a blowout. Before getting out of her car, she glanced in her rear-view mirrors and carefully looked around the vehicle. 

After all, an unaccompanied woman driving down the mean LA streets late at night just can’t be too careful. Come to think of it, after working in a Los Angeles area ER, I can assure you that no one can be too careful out there on a Friday night at 2AM. Shirley, brave heart that she was and true to her Scottish background, summoned her courage and got out of her car to check out the situation. 

She exited the van expecting to find a flat tire or even worse. To her surprise the vehicle checked out perfectly. The road she that she had just driven over reportedly looked fine. She apparently had not gone over a series of potholes as she had first thought. It was then that Shirley looked up and saw the lights.

On the ridgeline shining out from the hillside, she saw our two mystery lights. She recalled the one on the right was flashing on and off. It appeared to be signaling directly at her! The other light, (the one that I would be interacting with in a few minutes appeared less bright to her.) While standing by the side of her car, she wondered if we too could see the lights. They appeared to be coming from the hills directly behind our research site.

I told Shirley what we had experienced. She listened in silence.  I was somewhat perplexed that she didn’t seem surprised at all.  She accepted the anomalous nature of the events with perfect equanimity. She did not seem frightened about what had happened to her. I later found out that Shirley, as well as several other members of the team, were not strangers to the high strangeness associated with this type of work. Several members of the group apparently had previous interactive experiences with what appeared to be non-human intelligence. At that moment I had a lot to learn about the contact project, and even more to learn about the individual members of my team.

**SPECULATIVE ANALYSIS OF OUR FIELD INVESTIGATION**

What was I to make of all this? What was the significance of these highly anomalous experiences that occurred during our initial fieldwork?  As I reviewed and analyzed what had transpired, my theory about “crazed” teenagers being responsible for the mystery lights seemed less and less likely. 

First, we had been hit by powerful lightning like flashes of light while doing Coherent Thought Sequencing. I had no easy explanation for this.  Later we encountered anomalous lights that were rather sophisticated.  And I got the opportunity to interact with one of them at the very spot we had designated as our “safety area.” The rapidity of the light’s response to my signaling made me consider the possibility of a consciousness link between myself and the intelligence responsible for those lights. At about the same time, a Working Group member experienced a violent shaking of her car. This led her to stop the vehicle and look up and see one of the lights signaling in her direction. What could it all mean?

First of all, to skeptics I would like to state for the record that I have considered the null hypothesis. Yes, it’s possible that there is no special significance to any of these events. The lightning-like flashes were possibly unusual manifestations of a prosaic phenomenon, namely the weather.  In addition, ordinary humans could have engineered the mystery lights. That they had somehow gotten past the locked gate was certainly not impossible. But what would have been their motivation? To rock climb in the dark through “rattlesnake land” for a prank seemed rather unlikely.  Whoever had mounted such a complex operation must have had a very good reason. They had to be very well equipped as well. All this accomplished so that “they” (whoever that might be) could mock our light work and play games signaling at us? It just didn’t make sense. 

Moving further in this rather illogical line of reasoning, yes perhaps Shirley had gone over some potholes and that’s what shook her car. When she exited her vehicle, she simply missed seeing the road hazard due to the late hour and her being tired. One could just say that it was coincidence that she then looked up towards the pass at that exact moment and saw the lights. Moving further out on the limb, a debunker would probably say that perhaps Shirley’s part of the story was a complete fabrication. After all, she was the only witness to the strange things that she experienced on the road. According to self-styled debunker’s logic, “of course she made the whole thing up.”

From my perspective however, that would go against everything I know about her. We eventually worked together in the hospital for nearly twenty-five years when she suddenly died from a cardiac arrest. I never knew her true age, but my guess is that she was in her early sixties when this sad event happened.

It is my judgment that she was an honest and sincere individual. I was her contact team leader for several years and we spent many long nights carrying out group sky watch activities together.  The thought that she would deliberately prevaricate is not likely. In my opinion her lying to me on this subject is even more preposterous than the possibility that we had indeed contacted non-human intelligence, an intelligence whose technology could cause her vehicle to vibrate to stop her and compel her see the light.

 

It is my judgment that if we pursue want-to-be debunker’s brand of illogic, which often masquerades as “conventional wisdom,” then we will never understand anything about this phenomenon. It is my opinion that if we are to make any sense of this strange subject of UFOs, then we should do as contact groups request. And that is to deliberately interact with the alleged ETs in protocol fashion and then faithfully record our findings. Only in a diligent, industrious and well-intentioned effort, can we hope to expand human knowledge in this area. The possibility that extraterrestrial civilizations are visiting our planet warrants this kind of reasonable and responsible approach.

What I have reported here is by no means unique. The UFO literature is full of similar reports of mysterious lights, bizarre atmospheric like effects and anomalous physical phenomenon.  What is different about contact team operations is that these occurrences take place under very special circumstances, namely during deliberate attempts to interact with the intelligence that is presumably responsible for them. 

I am suggesting it was no accident that the lightning like flashes hit us during our meditation. If our thought projections while in a meditative state are successful in establishing communication, might not we receive an answer while we are sending the “welcoming” message? As in this case, a “reply” that for an instant turned night into day, certainly served to get our attention. At the same time it served to underscore the importance of meditation to facilitate communication with a non-human intelligence of that might be extraterrestrial.

I’ve already discussed the difficulties of getting up to the ridgeline at night. This would necessitate getting past a locked gate and avoiding rattlers while rock climbing over boulders in the dark. All that certainly presents considerable logistic problems. At least for humans it would. For a technologically sophisticated star faring culture, it might be a lot easier. And to further support this assessment, I point out that advanced civilizations might readily have at their disposal consciousness communication systems that would allow them to coordinate their light work with me in such a deft manner. 

Even the place where the “photon talk” took place has significance. The exchange ironically occurred at the very section of trail that we had designated as our “safety zone.” Our “cooling off” place was indeed the site where our encounter “heated up.” While light signaling back and forth is a rather primitive form of communication, the display of irony bespeaks of a more complex exchange with an intelligence capable of humor.

Shirley’s high strangeness experience was perhaps the most powerful reminder of what our presumed ET collaborators are able and willing to do to get our attention. We can only speculate as to what kind of advanced technology (possibly electromagnetic) that could have caused such a violent shaking of her car at some distance from our research site.  It truly seems as if something or somebody really wanted her to stop and “see the light!”  If the UFO phenomenon is caused by advanced intelligences attempting to assist mankind, it is my hope that “they” (whoever they might be) keep on trying to help us “see the light.”

**A Bit More of Discussion and the Conclusion of this Report.**

For those hearty souls who have been so kind as to wade through this detailed narrative, I salute you. I endeavor to describe how a UFO contact network operates by focusing on the fieldwork experience of one individual team, namely my own.  In my opinion, we have entered a collaborative relationship with the non-human intelligence responsible for the flying saucer phenomenon. The high strangeness component of these experiences, the inexplicable nature of the interactions tends to suggest that something truly unearthly is going on. Skeptics would of course correctly point out,” You have no proof!” Yes, that is certainly true. The historic landing of an ET craft and off planet experience by a contact team with video recorders on has not occurred yet. For that matter it may never take place.

Nevertheless, citizen teams are seeking contact all around the world. In my opinion this development indicates that something truly remarkable is going on at this point in the Earth’s history. For those reading this narrative, I urge you to consider that we are witnessing “alien civilizations” that are staging limited interactions with humankind. And this process is part of a much larger path leading towards open and direct contact. 

I would be the first to agree that such encounters are ambiguous, full of uncertainty, and at times they are frustrating for us.  As one who has worked in the non-human/human contact networks attempting to build a positive and peaceful relationship, I believe that the price is well worth it.

In the next chapter linked below, I describe several red glowing objects that hovered in the sky to the north of our research site in the Santa Susana Pass. I also report on an encounter with two Black Hawk helicopters that buzzed our contact team while hiking in Rocky Peak State Park. This occurred one night as an advanced party of our contact team operated near a high security research facility of the US Department of Energy.  Please stay tuned and keep watching the skies!",2026-05-21 03:39:49
