title,content,created
Anyone in Australia/Melb have p2 cards and a panasonic hvx200 charger?,"easy, came across a cheap panasonic hvx200 and a firestore (which i immediately sold to a friend, i hate external recording lol). however the camera came with no charger, seller misplaced it, and the only charger i bought on Amazon doesn't make correct contact with, nor charge any of my batteries, and two 4gb p2 cards will drive me absolutely insane. Anyone in melbourne, ideally, with a OEM charger/power supply (i have the battery dildo for AC power, so an OEM charger with the AC output would kick) and some 32 or ideally 64gb p2 cards? my only other option is buying a hpx170 for \[too much\] and get a charger and a 64gb p2, and seeing if i prefer the better handling, mildly wider lens and slightly better lower light of the 170 and sell one of them, but i can't be bothered to deal with getting it shipped to Melbourne, nor spending a grand on an ancient 720p camcorder. as I'd like to actually just shoot, lol",2026-05-21 15:26:40
Any luck with aggressive playstyle?,"Hi! I've had tough luck with castle/passive playstyle, now I'm imagining the aggressive rush with Urak Taar, Infernal Taurus + Reinforced Bull Centaurs for the shock factor and the rest of the guys will be chilling castle. Any thoughts with that?

Hahashut 2000/2000 pts

Helsmiths of Hashut

Daemonsmith Cabal

General's Handbook 2025-26

Drops: 2

Spell Lore - Lore of Infernal Power

Prayer Lore - Prayers of the Scorched Sect

Manifestation Lore - Forbidden Power (20 Points)

General's Regiment

Urak Taar, the First Daemonsmith (340)

 • General

Bull Centaurs (380)

 • Reinforced

Deathshrieker Rocket Battery (140)

Deathshrieker Rocket Battery (140)

Scourge of Ghyran War Despot (130)

Regiment 1

Daemonsmith on Infernal Taurus (290)

 • Greed Pistons

 • Crucible of Spite

 • An Eye for Weakness

Hobgrotz Vandalz (140)

 • Reinforced

Infernal Cohort with Hashutite Spears (200)

 • Reinforced

Infernal Razers with Blunderbusses (220)

 • Reinforced ",2026-05-21 15:25:20
does anyone recognise the tech or the video its from?,"im not expecting anyone to be able to decipher what components these were. im more so just hoping someone else has seen the video or made one of these.

ok so i remember a while ago i saw a short form video of how to make super cheap and simply DIY first gen Night vision. the IR spotlight and receiver kind. the total cost was under 50$. i swear i saved that post but ive been looking for hours and cant find it.

From what i remember there are only really 2 pieces. a visor of some kind that looked pretty old that had a display inside and a port on the side. it was made out of some kind of grey plastic. kinda shaped like Oakley Meta Vanguard glasses. it also \*MIGHT\* have had IR LEDs in a horizontal line across them. there was also what looked like a small, camera possibly IR that would actually pick up the IR spotlight cant remember if they had to remove the IR filter or not, i also cant remember if it was the visor or camera that gave off the IR light.

something i specifically remember is the camera used a TRRS AUX cable and the person who made the video said not to plug the AUX in all the way because then the video connection wouldn't line up. there might have been an adapter between the 2 maybe a 3.5 to RCA. it was literally as simple as connecting the 2 pieces and plugging it in. im assuming the visor is old and battery powered, not sure about the camera.

sorry for the vague skitzo rant but any help at all would be appreciated. if i see the pieces again i know i will recognize them.",2026-05-21 15:24:25
PC fails to POST after windows update. (Blinking DRAM),"Symptoms: Was perfectly fine prior to windows update and shut down. Later that night, I come back and on powering on, yellow DRAM light falshes and fans spin, but pc fails to POST. 

Things tried:

Full power off and power drain

Swapping ram sticks

Having just 1 ram stick in a2

Clearing CMOS with battery removal, with CLRT shorting

Resetting BIOS using usb with bios downloaded onto it

Trying all the above with/without SSD and all USB ports plugged in. 

Been verrryyyy excessive in patience in all things to allow time for clearing / resetting. 

Specs

Ram: ddr4 3600

Mb: TUF GAMING B550 - PLUS WIFI 2

CPU: RYZEN 7 5800x

GPU: 3060ti

Been scratching my head real hard on this one.. not sure what to do. Please help if you have ideas.",2026-05-21 15:22:48
"Springs, always springs","Hello everyone,

As an owner of a Specna Prime airsoft gun, I'm limited in my local games to either 1 joule or 1.2 joules.

I know that the combination of the high-end gearbox and the brushless motor makes the Prime models competition-grade replicas, but I understand that this can be a disadvantage when their power needs to be reduced.

Ideally, I'd like to be able to play in either M90 or M100 mode. The M100 produces 1.2J, I imagine the M90 ​​will go down to 1J, BUT I don't want to risk damaging the replica in any way because of these regulations...

So I looked at the springs and noticed that Specna offers several sizes for the same part number:

[https://gunfire.com/en/products/specna-arms-m100-tuning-spring-for-aeg-replicas-1152243371.html](https://gunfire.com/en/products/specna-arms-m100-tuning-spring-for-aeg-replicas-1152243371.html)

and

[https://gunfire.com/en/products/m100-specna-arms-main-spring-1152221038.html](https://gunfire.com/en/products/m100-specna-arms-main-spring-1152221038.html)

With two different sizes. I'd like to know why this difference and which of the two would be the most suitable, and why. Does anyone have any explanations? I can't find anything on YouTube or here, unfortunately.

Regarding the M90, there are also two versions, like the M100:

[https://gunfire.com/en/products/specna-arms-m90-tuning-spring-for-aeg-replicas-1152243370.html](https://gunfire.com/en/products/specna-arms-m90-tuning-spring-for-aeg-replicas-1152243370.html)

and

[https://gunfire.com/en/products/m90-specna-arms-main-spring-1152221037.html](https://gunfire.com/en/products/m90-specna-arms-main-spring-1152221037.html)

Again, there's a difference in size and price!

Would this size difference allow me to use it without risking damage to the replica, while still maintaining the responsiveness of an 11.1v LiPo battery?

Thanks for your feedback.

See you on the field! :)",2026-05-21 15:21:17
Why do you want?,This post contains content not supported on old Reddit. [Click here to view the full post](https://sh.reddit.com/r/BunnyTrials/comments/1tjbskc),2026-05-21 15:18:47
Sigenergy Setup questions,"Hi all

(Crude wiring diagram for context)

Looking at getting a Sigenergy solar/battery setup on my property

We have the main meterbox on a pole in the middle of our property, and 4 buildings connected to individual 63A circuits that then go to each buildings respective subpanel.

We also have a diesel generator connected to a changeover isolator switch in the main meterbox on the pole which lets us flick between mains or generator for when we have a power outage.

We are looking at 18.5-24kW of solar on the main house, with a 48kW battery (potentially over 2x inverters w/ 3 banks per inverter). Hoping to have the battery service the entire property and not just the main house.

I know the inverters and gateway are limited to 12kW capacity - but we can consume up to 20kW of power at any given time. Unfortunately we are only single phase and our grid does not support a 3 phase upgrade.

I understand the parallel inverters which allows this to go up to 24kW throughput to make full use of the solar panels to charge the battery more efficiently, but I'm confused with the gateway.

Installer is saying we can have the batteries/inverter on the main house, and the gateway at the pole (and somehow 'trick' the gateway to use the main house's circut to feed the battery into the gateway)

the gateway is still only 12kW limited though, so what happens if we are consuming 20kW? 

Assuming 12kW through the gateway from the battery, and 8 from the grid? But what about during a power outage, or when the generator is active?

I would assume that we could wire up the gateway from the output of the generator changeover isolator switch so it would think the generator is just a standard 'mains' input so it can make use of the higher throughput vs hooking it up to the backup input?

I thought I saw somewhere there was an upgraded SP gateway (HomePro SP-F) that could support 100A mains and multiple inverter inputs, but I can't find much info about it on whether it is still limited to 12kW total or not.

Any advice or feedback welcome

Thanks in advance! ",2026-05-21 15:08:26
"I guess if Amazon says I shouldn't use this anymore, it might as well be a clock!",,2026-05-21 15:01:50
Is my SOT okay for average usage,So I just got my Realme gt 7t 3 days back and I am curious how much SOT would this 7000 mah battery would give above is my battery usage and also share yours.,2026-05-21 14:58:51
From Silicon Valley Icon to National Security Asset: The Financial Rebirth of Intel,"&amp;#x200B;

To prevent a strategic collapse in domestic chip capacity, the U.S. government converted Chips Act subsidies into direct equity. Washington now holds nearly 10% of Intel — over $35 billion — turning a private company into a national security asset.  

Nvidia invested $5 billion into Intel Foundry. The logic is blunt: Nvidia cannot let TSMC alone dictate supply for AI data centers. It needs a second source, and it wants Intel’s CPUs tightly coupled with its own GPUs. SoftBank added $2 billion more.  

Intel is no longer just a company. It is a hedge.  

For 30 years, Intel built chips for itself. Now it builds for others. The breakthrough came when Apple signed a preliminary agreement to test production of A-series and M-series chips on Intel’s 18A and future 14A nodes. Apple doesn’t gamble with its silicon roadmap. A test run is a signal.  

Parallel to that, Intel launched Project Terafab with Elon Musk — a bid to build hyperscale foundry infrastructure on U.S. soil, directly challenging TSMC’s monopoly in advanced contract manufacturing. Musk brought something larger than capital — a vision called Terafab.

Backed by Tesla, SpaceX, and xAI, the project began in March 2026 as a 20-to-25-billion-dollar semiconductor initiative.

But the numbers did not stay there.

Within months, projections surged toward 119 billion dollars, with the opening phase alone consuming more than 55 billion.

The scale is almost difficult to visualize: a plan to generate one terawatt of AI compute annually — many times beyond the capacity of today’s global AI infrastructure.

The technical anchor is 18A, Intel’s 2nm-class process. Intel claims high-volume manufacturing is live. The proof is Core Ultra Series 3, “Panther Lake,” now rolling out globally, including Vietnam. It targets the AI PC era with graphics and battery gains meant to blunt ARM’s advance.  

Intel is also deepening its Vietnam footprint, transferring more equipment and tightening supply chains with local partners. 

Southeast Asia is quietly becoming part of the new silicon frontier.

The market noticed. Q1 2026 revenue hit $13.6 billion, beating expectations. INTC has tripled in twelve months, reclaiming dot-com era highs at $80–$100 per share.  

But beneath the rally is stress. Intel’s traditional server business continues to bleed share to AMD and ARM in Q1 2026. And geopolitics cut both ways: when U.S.–Iran talks stalled, the entire semiconductor sector, Intel included, dipped.  

So the new question: Can Intel challenge TSMC’s monopoly?  

To understand the gap, start at the root.  

TSMC’s model: Pure-play foundry. Since 1987, one rule: “We never design chips. We only manufacture for others.” That builds absolute trust. Apple, Nvidia, AMD can hand over their most secret designs knowing TSMC will never compete with them.  

Intel’s model: IDM. Integrated Device Manufacturer. For decades, Intel designed and built its own chips. When it opened Foundry Services, it hit a psychological wall: Why would AMD or Nvidia trust their blueprints to a direct CPU and GPU rival? Spinning off Foundry as an independent subsidiary is Intel’s attempt to solve the trust deficit.  

But trust is only half.

TSMC runs a perfect feedback loop. Thirty years of orders from thousands of clients. Every wafer teaches the system. More volume means more data. More data means higher yield rate — the percentage of good chips per wafer. Higher yield funds more EUV tools from ASML. That buys the next node. Repeat for 40 years.  

Intel broke its own loop. From 2015 to 2020, it underestimated EUV, delayed 10nm and 7nm, and spent cash on buybacks instead of fabs. When Pat Gelsinger took over in 2021, Intel was nearly two process generations behind.  

Now Intel claims 18A is ready. But the market scoreboard is brutal:

TSMC controls roughly seventy percent of the global foundry market — and more than ninety percent of the most advanced nodes. 

TSMC doesn’t dominate because of one machine or one breakthrough.

It dominates because the entire industry already runs through it.”

​The reality? Intel’s fabs still feed itself. It has yet to break into the elite commercial ranks. But the gears are turning. Pilot deals are signed. Tech giants like Apple and Microsoft are already holding early samples. 

Semiconductor manufacturing isn’t theory. It’s mechanical precision earned through decades of repetition. You cannot buy experience. You earn it, one defective wafer at a time.  

Intel is a sprinter entering a grueling endurance race. It has capital and political backing. But TSMC has owned this track for 40 years, knowing every pothole in the global supply chain. 

\---

The gap between Intel and TSMC is not money or technology alone. It is ecosystem and operating structure, accumulated over decades.  

The cause: The conflict of interest. TSMC’s purity is its power: “We do not compete with customers.” Intel, even with a separate Foundry subsidiary, is still a CPU and server company. AMD will never fully trust a direct competitor with its crown-jewel architecture. Intel’s legacy as “x86 empire” is its own ceiling.  

The process: The data flywheel and culture. Chipmaking lives and dies on yield rate. TSMC’s fabs run 24/7 with military discipline, fueled by billions of chips worth of learning. That culture is not exportable to the U.S. or Europe at the same cost or speed. Intel faces higher labor costs, slower incident response, and regulatory drag in Western fabs.  

The result: Geopolitics, not market share. Over the next 10–20 years, Intel’s real goal is not to beat TSMC outright. It is to become America’s survival option.

In total efficiency, customer breadth, and ecosystem maturity, TSMC is a mountain Intel cannot climb in one or two decades.  

But Intel doesn’t need to summit. If it can prove it manufactures advanced nodes at all — even at higher cost, with lower yield — Apple, Microsoft, and Washington will still allocate orders to de-risk Taiwan. Intel lives as the protected second place.  

\---

The Quiet Predator:   

While Intel fights the narrative, Samsung is the silent heavyweight. It rarely brags, but its weapons are real.  

First, it bet early on GAA. While TSMC safely optimized FinFET through 3nm, Samsung jumped to Gate-All-Around — its MBCFET — at 3nm. The first generation struggled with yield. But Samsung now has years of real-world GAA data. As the race moves to 2nm SF2, TSMC and Intel are just starting the GAA transition. Samsung is already on generation two and three.  

Second, TSMC’s backlog is Samsung’s opening. TSMC’s advanced capacity is booked through 2028 by Apple and Nvidia. AMD, Qualcomm, even Tesla are squeezed. Result: orders migrate. AMD’s CEO Lisa Su visited Samsung’s Pyeongtaek fabs. Financial analysts confirm AMD is seriously evaluating Samsung’s 2nm GAA for next-gen Venice and Verano CPUs.  

Third, Samsung owns the full stack. TSMC makes logic chips and buys memory elsewhere. Samsung is the king of DRAM and NAND. It can build 2nm logic + HBM4 + advanced packaging in-house. One vendor, end-to-end. That cuts cost and time at industrial scale.  

The real scoreboard: TSMC holds ∼72% of pure-play foundry. Samsung Foundry holds ∼7–8%. The gap looks huge. But Samsung doesn’t need to take all of TSMC’s share. It is the technological counterweight. Samsung is a chaebol with limitless capital and a consumer electronics empire — Galaxy, appliances, displays — that funds its chip ambitions. If TSMC faces overload or Taiwan risk spikes, Samsung is the only player with GAA maturity, memory supply, and fab scale to absorb flagship orders.  

\---

Intel’s Future: Two Wars, One Clock  

Intel’s turnaround is the most expensive, risky, and politically tangled bet in modern tech. The difficulty is not capital. It is this: Intel is paying for a lost decade by performing two open-heart surgeries at once.  

 Beautiful revenue, burning cash.  

Q1 2026: $13.6B revenue beat Wall Street. But Intel Foundry still bleeds billions per quarter. EUV High-NA depreciation, new fabs in the U.S., Ireland, Malaysia — all burn cash. Free cash flow will stay negative or near-zero through 2026. Intel survives on subsidies, asset sales like Altera and Mobileye, and strategic checks from Nvidia and the government. A tech giant dependent on aid faces suffocating pressure from shareholders and Washington.  

Fighting on two fronts.  

TSMC focuses on manufacturing. Nvidia and AMD focus on design. Intel must win both:  

Design war: Defend PC and server CPUs against AMD and ARM. Panther Lake is progress, but AI performance and price pressure are brutal.  

Manufacturing war: Perfect 18A, then race to 14A. One slip — a flawed chip or delayed fab — triggers a domino collapse.  

The silent killer: Yield rate.  

Lab success is not mass production. For Apple or AMD to shift from TSMC, Intel must prove yield above 70–80% at 2nm. Today, Intel’s industrial maturity lags TSMC’s. If defects run high, Intel eats the loss to keep clients, or clients flee back to Taiwan after the pilot.  

The political leash.  

U.S. equity is a shield and a shackle. Intel must build in America and Europe — higher cost, stricter regulation than Asia. Political management slows reaction time in a market that changes by the quarter.  

The bottom line:  

Intel’s future is harder than it looks because it has no retreat and no room for error.  

TSMC or Samsung can lose a year and recover. Intel’s clock runs to 2027–2028. If tens of billions in subsidies don’t make Foundry self-sustaining and yield-competitive, Intel risks being broken up or becoming a “zombie entity” kept alive by national budgets. A bitter end for Silicon Valley’s once-great symbol.  

The question is no longer “Can Intel survive?”  

It is: “Can Intel execute flawlessly, for years, under political weight, against two opponents who have already run this marathon?”  

The next decade will decide not just who builds the fastest chips — but which nations control the systems that run the modern world.",2026-05-21 14:50:45
"I guess if Amazon says I can't use my Kindle, it might as well be a clock!",,2026-05-21 14:50:18
My Weird 1978 Suzuki GS550,"Hello, I’ve recently bought a Suzuki gs550 and I’m coming to an issue with lots of stuff   
Firstly the front blinkers are messed up. When I turn it to left, the right light turns on. The back blinkers work just fine but the front are being weird  
My 2nd issue is that it has power but it doesn’t start. The bike turns on, but when I press the power button, nothing. It doesn’t crank, no noise, it’s like pressing a button on a tv remote except the tv is not there.  
My last issue is that there’s a tube that I have no idea where it goes. It’s plugged to the top of the engine but I can’t seem to find out where it goes. It doesn’t have a AirTank next to the battery so I’m thinking it’s a vacuum tube but not sure  
If there’s anyone who can help me out and can actually give me good advice it would mean a lot as it’s my dream bike and I want to revive this ancient piece of shit",2026-05-21 14:46:16
Parking tips for St. Louis Cardinals vs Atlanta Braves at Truist Park (Atlanta 06/30),"  
  
hey everyone, figured i-d share some tips for the cardinals vs braves game on 06/30 since parking around truist park can be a total nightmare if you dont have a plan. the area gets so congested and they have very specific rules you need to follow if you dont want to get stuck in your car for hours.  
  
first off, check out Prked. you can basically rent out someone-s driveway or a private garage right next to the stadium. it is usually way cheaper than the official braves lots and you get to skip the massive traffic jam when the game lets out since you arent stuck in a stadium deck with thousands of other cars. plus the walk is usually pretty short and it feels way more chill than dealing with the official crowds.  
  
if you want to go the official route, you absolutely have to buy your pass in advance through the mlb app. they rarely sell parking on-site and the lots will show as sold out long before first pitch. the red deck and green deck are right there in the battery but they are the most expensive and hardest to exit after the game. lots like 29, 31, and 43 are a bit further out but they have shuttles that run back and forth. just keep in mind that lot 29 is the only place they actually allow tailgating if you were planning on grilling out before the 7:15 pm start.  
  
traffic at the i-75 and i-285 interchange is some of the worst in the country, especially on a tuesday night in june since you are hitting the tail end of atlanta rush hour. try to get there at least two hours early around 5:15 pm if you want to walk around the battery or grab food without being stressed. windy ridge pkwy and cobb pkwy get backed up for miles so try to use back roads like powers ferry if your gps allows it.  
  
parking in the battery decks like the red, green, purple, or yellow decks has strict game day rules. you might get a little time free during the day, but on 06/30 they will charge you high game rates unless you spend at least fifty dollars at the shops to get a validation. honestly, those decks can be a trap because getting out after the final out can take an hour just to leave the garage levels.  
  
there are some private office buildings nearby on interstate north pkwy that sometimes sell spots through various apps. these are usually a 10-15 minute walk across the pedestrian bridge but they are way easier to escape from when you are trying to head home. marta does not have a rail station here, so you would have to take a bus from the arts center station which can be pretty slow in game day traffic. if you use uber or lyft, there is a designated zone on windy ridge pkwy but the surge pricing after the game is usually double or triple the normal rate, so maybe grab a drink at the battery and wait an hour before calling one.  
  
hope this helps and enjoy the game.",2026-05-21 14:30:17
EV charger overheating issues?,"I recently started noticing my home EV charger getting pretty warm during longer charging sessions, especially overnight. It hasn’t shut off or anything, but the heat definitely feels more noticeable than before.

I’m wondering what usually causes Electric Vehicle Chargers to overheat? Could it be bad wiring, too much power draw, poor ventilation, or maybe just normal during hotter weather?

Also curious if this is something that can eventually damage the charger or even affect the vehicle battery over time. I was actually talking with the team at [Cali Coast Electric](https://www.calicoastelectric.com/) and they mentioned that improper installation and overloaded circuits are pretty common causes, but I’d love to hear real experiences from other EV owners or electricians too.

Anyone else dealt with this issue before?",2026-05-21 14:22:47
Roach infestation,"Hi guys! Thanks in advance for any advice.   
We moved into a new apartment about two months ago and we found roaches almost immediately. We notified the apartment complex asap and they scheduled an exterminator. We kept seeing roaches and we had the exterminator come again less than a month later.  Management told us that they would do a “treatment” and after that the problem would be solved. There have now been two treatments, and I’m seeing more roaches than ever. I believe that this is a building wide issue and I’ve complained to the city health department. I’ve tried Raid, the battery powered spray, bait boxes, the small black poison things that supposedly kill the nest, and now I’m using the harris BA tablets. What should I do to try to keep them out or kill them?",2026-05-21 14:21:01
