title,content,created
Need tips to help my mom have a better cruise 😭😭😭,"I'm on the Sun Princess right now and my mom is having a miserable time because her ""sciatic"" is acting up. I need some tips on how to make this trip better for her. Here's what's happened:


-In Marsaille we looked at the church, but that was too much walking.

-In Genoa, we got tickets for the hop-on double decker bus, but it took TWO HOURS of waiting in line next to a busy, smoggy road just to get on the bus. Then the driver drove like a maniac. She has been complaining about this excursion since.

-In La Spezia, we took an excursion to Pisa but the walk from the bus parking lot to Pisa was too much for her. She was angry at the tour guide and group for walking ahead.

-Back on the ship, she has trouble making it from her room to the dining room and gets angry if we get lost, causing her to walk extra. This is a new ship for us, and has been quite different from the Ruby/Royal/Crown.

-She refuses to use a cane or wheelchair.


I've been so stressed out trying to make everything work, but unlike Alaska, getting anywhere in Europe requires some walking. I did warn my parents before this trip and they insisted they would be fine, which is not the case.

Our remaining ports are Bar, Corfu, and Civitavecchia. My parents really want to go to Vatican and Trevi Fountain, but I cannot find a single excursion that doesn't require at least a 5 minute walk to the entrance, plus standing in line. Any advice on how to navigate this? Would a private taxi drop us off/pick us up right next to these entrance so my mom doesn't have to walk (doesn't help we are on a time crunch in Rome)? Does the cruise ship offer wheelchair rentals while we are on board (though good luck getting my mom to use one). I am so stressed out over this it's keeping me from being able to relax.",2025-10-15 18:28:37
"Amputation of ""healthy"" feet?","Age: 44      
Gender: Female       
Height: 5' 8""      
Weight: Last I knew, 217. It's likely less than that now, but nowhere around me has a wheelchair scale 🤷‍♀️      
Smoke: Never      
Alcohol: Only a handful of individual drinks a year     
Drugs: Just my medical cannabis gummies, 10-20mg total on any given day depending on pain levels     
 
Medications:      
&gt;Daily: 30mg oxycodone, 20mg atorvastatin, 20mg omeprazole       
&gt;Weekly: 15mg Mounjaro      
&gt;Supplements: cranberry, vitamin D+K2, vitamin E, vitamin B complex, magnesium, potassium 

Diagnoses:       
&gt;Present: Peripheral Undifferentiated Spondyloarthropathy with extensor tendon contracture of both feet, Type 2 diabetes without complications or insulin use (A1C is a little elevated at 8.1, but it's not the 11.7 it used to be), PCOS, lymphedema, GERD, microcytic anemia, mild essential hypertension, extreme chronic vitamin D deficiency, mild neuropathy in the feet        

&gt;Previous: Duodenal perforation (healed on its own), gallstones (removed gallbladder), kidney stones/sepsis due to the blockage (surgically removed), malignant ovarian neoplasm with atypical uterine bleeding (total hysterectomy and left oopherectomy), skin ulcer of right calf with fat layer exposed (healed).

----------------------------------------------------------------- 

**THE ACTUAL QUESTION (finally!):**

How can I convince my medical team to remove both my feet, even though I do not have a current acute emergency regarding them? 

I am a powerchair user due to my extremely aggressive case of spondyloarthropathy having fused or extremely limited the range of motion in all of my joints. The contractures in my ankles mean that my feet hang over the end of my footplates and point down to the ground. I cannot wear shoes due to my foot deformities, so this leaves my feet completely unprotected and very vulnerable, all while being extremely sensitive to the point where I can't stand them being touched. If people bump into them, they are in acute pain for up to six hours. I am still experiencing pain from an accident on the bus that happened last May, even though none of the toes ended up being broken. They are just so, *so* sensitive. 

The constant inflammation of the USpA also leaves me with brittle bones, plus the diabetes means that my feet take a long time to heal if they get hurt, and they are *so easy* to injure these days. I am as careful as I can be with them, but sometimes my toes/feet get jammed. It can be into the pavement if I am trying to navigate a steep curb cut, in the van if we hit a bump in the road, into the wall of a small elevator, etc. 

This also means that my partner and I have to constantly be hypervigilant about my feet whenever we leave the apartment (and honestly even while we're home because of our cat). It's a constant mental stressor that keeps us from being able to enjoy ourselves on the rare occasion we get to go out for fun. At home, they'll often hurt while I'm simply hanging out in bed, even though I have a hospital bed and raise my feet so much that they don't make contact with the mattress. We can't relax out and about, and we can't relax at home. My feet are nothing but a medical liability, a bad accident waiting to happen, and a constant pain and source of stress. I don't even know if I would have high blood pressure if I didn't have to constantly worry about my damn feet. 

How can I convince my medical team to sign off on amputation while my feet are technically still good in terms of circulation and tissue health? The doctors I've mentioned it to (rheumatologist and primary care doctor) have both looked at me like I was crazy, and I'm afraid I won't be able to get them, let alone a surgeon, on my side, especially since I'm diabetic. I just want to be able to enjoy my life again 😞

If you read all this, THANK YOU. It's a dang novella before you even get to the question part, lol. Please let me know if there are any magical words or phrases I should use to help sway opinions, because I can't really live like this for much longer.

Edit: I posted a quick illustration of my situation in the comments! ",2026-03-23 08:28:07
"this is what my friend, a wheelchair user, has to traverse to get to a bus stop. the accessible bus stop was discontinued to make room for car traffic. the sidewalk on the other side only goes down part of the road. the right to travel needs to be protected",,2023-01-15 09:11:13
"What you buy with 8$/mo in ""Transit Taxes"" (long)","There is a lot of opposition to the Choose How You Move referendum. A lot of this comes from the half percent increase in sales tax, which equates to roughly one dollar from every 200 spent going into taxes. So for a family buying 1,600$ worth of taxable goods, it comes out to around 8$, or at current gas prices, less than four gallons of gasoline. 

So starting with the gasoline, averaging 20 miles per gallon, you cover this cost by not driving 80 miles a month. Which might be a stretch for a lot of people, but biking and public transit makes this exceptionally viable for a lot of people. Not paying for parking for one event, one night at the bar, etc, by taking public transit would cover several months of this. 

While true, few people would take the bus ""all the time."" But if even if trips were reduced by 10%, traffic would flow much better. The construction of the new Dr. Ernest Rip Patton Jr. Transit Center in North Nashville has already increased bus ridership in that area by 37%. Meaning that station has increased job opportunities and general mobility for many people as well as taking personal automobile traffic off of the roads. Even if you're not using that transit center, you're feeling it's benefits as a driver. (https://www.wegotransit.com/dr-ernest-rip-patton-jr-north-nashville-transit-center-officially-opens/)

As auto accidents increase, so do insurance rates. This is true for uninsured motorist volumes as well. By providing people other opportunities than driving, you remove some of the uninsured motorists from the road. It's simply not worth the risk of driving if there are options that don't take up much more of your day than if you drive. The national average in 2022 was 14%, and Tennessee is around 20%. (https://www.iii.org/fact-statistic/facts-statistics-uninsured-motorists) Reducing this by any appreciable amount will cause insurance rates to drop. Reducing the amount of people on the roads through quality public transit will reduce crash rates and uninsured motorist rates, meaning cheaper insurance rates for everyone who is paying for it. 

This isn't even getting into replacing the traffic lights that are currently analog and ran on a manual clock system. This is why you get stuck at a red light when no one else is around. These situations would end, and by allowing sensor lights, there wouldn't be red light changes on main roads when there isn't any cross traffic that needs through. This leads to an increased throughput capacity and higher average speed, even if the speed limit were reduced. Saving not only money, but time as well. 

Children don't play outside anymore in no small part because it's not safe for them to do so. Providing sidewalks and multimodal transit options makes it safer for kids to play outside. It gives them safe ways to bike to the park, or even bike/walk to school making a parents morning much less stressful. It would also reduce the exhaust pollution around the school, something I'm sure we don't want our next generation to be breathing. As the kids grow older and get into sports, it could mean less running around to pick up and drop off kids making it much easier to be a parent. It also gives them more freedom of movement in general, particularly in the summer months. 

Currently, a lot of the sidewalks in the area have telephone poles in the middle of them. This means they cannot accommodate wheelchairs and mobility scooters. Reworking these sidewalks gives these users greater freedom of mobility. Especially when paired with a public transit system that gets them closer to the places these people need to go. No one wants to be a burden on others and ask for rides all the time, and giving dignity back to people who cannot drive for health reasons will some day help all of us. Whether through injury or old age, at some point we shouldn't be driving anymore. 

Perhaps the biggest thing this referendum will do, if passed, is create a dedicated public transit fund. If this happens, Federal Tax Dollars that you are paying will come back to Nashville. Currently they are going to build public transit in St. Louis, Atlanta, and literally anywhere else but here. So for the 8$ a month in taxes that you would pay into the Nashville Public Transit Fund, you would get 16$ worth of funding. This would also open up the option for curb street parking fees to go into the public transit fund. 

Nashville has a lot of beautiful parks. Many of them are hidden in unsuspecting places that you probably won't find by your car. You'll only see them, most likely, by going out and walking or biking to them. All of the building murals are best enjoyed at pedestrian speeds, and they are all over this city. Get out and go see them, explore your city by foot or by bike, and learn about new places to eat, recreate, or sit and have some quiet outside time. This referendum will make that more feasible for a lot more people.  It will reduce traffic fatalities, reduce automotive costs, and create a safer space to enjoy the outdoors. 

No, I'm not associated with this referendum, so I may have some details wrong. I'm just a nerd who's read one or ten too many books and loves to ride bikes. I've also studied some the history of what Nashville public transit looked like in the 1930s, and would love to see the 2030s be the return of it( without the cause of the streetcar boycott). There is a reason the old Union Station building is so beautiful. 

Edit: Please, no personal attacks. If you need to discuss, do so civilly. We have time to think and plan our response online, and that can be time spent practicing being cordial. Making derisive attack statements won't get us anywhere, and certainly won't improve our communities ability to communicate.",2024-10-11 04:13:20
