title,content,created
How wheelchair's are carried on a bus in Japan.,,2025-03-01 10:30:22
Woman on bus will not give a seat to a disabled man in a wheelchair.,,2022-05-05 01:47:38
Asked me to get out of the wheelchair spot on the bus for her stroller??,"I'm a wheelchair user and was taking the bus like I always do. There's specific spots at the front of the bus that are for disabled people and the elderly to use.
I was sitting in my wheelchair strapped into the bus, and a woman with a twin stroller got on and asked me if I would get off so she could put her stroller where I was parked. 
I told her that I would absolutely not, this spot was for disabled people not her stroller and she can take the next bus if she really  needs to.
 She tells me she has an appointment to get to, so I tell her right back that she can fold her stroller up and go further into the bus if she really needs to take this one but I'm not moving.
She gestured at my crossed legs and
She had the BALLS to ask me to fold up my wheelchair and WALK it to farther back. I am able to walk, just not much. 
I literally just started laughing and she accused me of faking my disability?  She refused to move out of the front of the bus area where the driver can't have people and was promptly kicked off the bus. Good luck getting to that appointment lady",2023-11-30 08:38:21
"At most hotels, the machine to lift people in and out of the water is covered, and turned off. You need to get someone at the front desk to come turn it on... and half the time I've tried it, it doesn't work",,2025-08-14 20:59:07
"I’m 15, my 17 year old sister just died.","For context, my older sister was born a litte deformed, and with a condition called partial trisome 2-Q syndrome. It’s very complicated to explain, but basically she had a genetic mutation and was forever mentally a 3 year old. 
She had to wear adult briefs (diapers), had a G-tube hooked up to her stomach (fed her formula for nutrients), and had multiple problems with her digestives and her legs. She word shin leg braces to walk correctly, and didn’t have very good body coordination at all. Her hands were too lean and fragile to do much other than grab things.
So yes, she was in the special education (SPED) program at our highschool we went to together. 

It was just a regular day. Everyone was fine, she was fine, I was fine, the whole fam was doing alright.
Morning routine, Wednesday morning. I wake up, get dresssed, put on my shoes, grab my house key, phone, wallet, and backpack. I push my sister in her wheelchair onto the short bus's (SPED BUS) buslift every morning. She was okay that morning, Wednesday morning.I went to my bus afterward. I don't tend to see her throughout the school day, since I'm in the regular student's program and not the special ED one at all, and she was a junior. I'm a freshman.
After school, she seemed ill. She was pale, and uninterested in anything that she would usually enjoy. Something was wrong. So, my stepmom gave her some tylenol. Pretty soon, she was back in the spirits, her bright soul shining as she giggled and squealed at things that would make her laugh. Again, she was like a 3 year old in a mature body.

The next day, Thursday, same routine in the morning. get ready, push her on the bus, go to my own bus.
After school, she again looked ill. But this time, her tummy was bloated like a balloon. But she wasn't squishy. She was firm in the tummy.
My stepmom rushed her to the hospital. There, they couldn't figure out what was wrong. They performed emergrency surgery. She's had emergency surgery a few times before. Everyone assumed she was fine. But this time, she almost died. She spent the night in the hospital, my stepmom spent the night with her there like she always did when things like this would happen.

Next morning, Friday morning. I woke up, did my morning routine except without her. 
I went to school.
5th period, late into the school day, right before last period. I was pulled out of class and sent to the office with a pass labelled 'early dimissal'. When I went to the office, I saw my younger sister there. She's still in middle school, 8th grade. She didn't go to my school yet. I was in a good mood. Asked her what she was doing here, called her silly in a playful tone. but she looked upset. She didn't respond.
The office lady led me back to a conference room. In there, I saw my dad, stepmom, and the whole SPED team branch of my highschool. I looked to my stepmom's face. Crying. I looked to my dad's face. Crying as well. And that's when I knew. That's when my body began to shake, and tremble. I couldn't stand, I was shaking so much. I wailed louder than anyone else in the room. I found out just how loud I could howl in pain and agony that day. It's... loud. Hearing myself made me even more sad.
My older sister, dead. Her like taken by an infection that swelled her up inside. It was in her blood. It got to her heart... and it made her heart stop.
My parents described the scene to me like it was something out of Grey's Annatomy or Good Doctor. 
A whole team was on her. Docotors, nurses, surgeons. Her monitors began to go crazy. They were doing CPR, zapping her heart, but after a while, they had to stop. And called the time of death.
April 25th, 2025, around 11:40, right before noon.
And the worst part? Her birthday was just on the 17th.

Her being occasionally in and out of hospitals was normal to me throughoout my childhood. It happened a lot due to her conditions. I began to feel numb at it, it had just became too normal. It go to a point where when she would be in the hospital, I would always feel numb from it.
On a side note, I was looking for a kitten at the time, just before everything happened. I was suppposed to pick up the kitty on the 26th, I was going to cancel on the seller because of the family emergency. But my parents stopped me. They told me to make damn sure I get a kitten. They said it would help with the coping. And oh my, it has. Now, I have this sweet baby boy to look after. He's helped me feel so much better. I love him so much.
His name is Gene. I named him after my sister's middle name, 'Jean.'
&lt;3",2025-04-29 06:20:16
wheelchair “helper” on bus today,"I’d like to preface this by saying that I would’ve preferred to talk to him in person, but he was in such a rush to get back to his seat and yell to his buddy about how “you can’t even be helpful these days” that I didn’t get a chance since I was the other person in a wheelchair…

\*\*If you want to be helpful to someone in a wheelchair, \*ask\* how you can help\*\*, don’t just try and grab their chair to haul them off the bus. Like she practically had to yell at you to stop. She was new to wheelchair use and trying to get the practice; the bus was not very busy, and it was not rush hour. Anyway, grabbing someone’s medical device is like grabbing a part of their body. Like if you were in my way, I wouldn’t just grab you by the legs and carry you somewhere else and deposit you there. Also, you almost crushed my hands as I was folding in my footplate to get out of her way. 

Also, folks with \*\*strollers: if they are foldable, please stow them\*\* if you see more than one wheelchair, or just try to tuck in as much as you can (like the helpful lady do who was there with her cute kid! You did a good job).

If you managed to get this far: thanks for attending my public service announcement. lol",2026-05-02 07:27:51
