연도,수집구간,제목,내용,날짜,링크
2024,2024.01.01. ~ 2024.12.31.,질문장기요양 3등급,"어머님이 3등급을 받으셨습니다. 1. 방문요양이 하루 3시간이라고 알고있는데 일주일에 며칠까지 가능한지요? 2. 개인 100% 부담으로 2시간을 추가해서 서비스를 받을 수도 있나요? (총 하루 5시간) 된다면 비용은 어느 정도인지요? 3. 아는 분이 요양보호사 자격증이 있어서 그 분을 오게 하고 싶으면 어떻게 하면 되나요? 4. 현재 전동침대, 휠체어 대여, 기타 복지용구 구입 등으로 사용하는 연 160만원을 다 사용했는데 그것과 재가급여는 별도인가요?",작성일2024.04.21,https://kin.naver.com/qna/detail.naver?d1id=6&dirId=6100103&docId=468435305&qb=7Zyg7LK07Ja0IOyepeyVoA==&enc=utf8
2024,2024.01.01. ~ 2024.12.31.,질문장애인의날 문제좀 풀어주세요 ㅠㅠ,"1. 자립생활은 누군가의 도움 없이 스스로 모든것을 하는것이다  O / X 2. 장애인자립생활센터의 주요 사업으로는 자립생활기술훈련,활동지원사업 연계등이있다 O / X 3. 장애인자립생활센터는 거주시설이다 O / X 4. 장애를 가지고있지않은 사람을 비장애인이라고한다  O / X 5. 시각장애인은 모두 점자를 읽을수있다   O / X 6. 휠체어를 탄 장애인을 만나면 밀어주거나 도움을 줘야한다 O / X 그리고 사진속 편의시설이 3가지라는데 그 3 가지가 뭘까요...?",작성일2024.04.21,https://kin.naver.com/qna/detail.naver?d1id=6&dirId=6100102&docId=468417328&qb=7Zyg7LK07Ja0IOyepeyVoA==&enc=utf8
2024,2024.01.01. ~ 2024.12.31.,질문장애인의날에 대해서 잘아시는분??,이거 빈칸 정답이 먼가요...? 그리고 장애를 가지고있지않은 사람을 비장애인이라고한다  O  X 시각장애인은 모두 점자를 읽을수있다   O X 휠체어를 탄 장애인을 만나면 밀어주거나 도움을 줘야한다 O  X 이문제들도 풀어주실분,작성일2024.04.20,https://kin.naver.com/qna/detail.naver?d1id=6&dirId=61303&docId=468393387&qb=7Zyg7LK07Ja0IOyepeyVoA==&enc=utf8
2024,2024.01.01. ~ 2024.12.31.,질문장애인의날 퀴즈 문제좀 풀어주세요..,이거 빈칸 정답이 먼가요...? 그리고 장애를 가지고있지않은 사람을 비장애인이라고한다  O  X 시각장애인은 모두 점자를 읽을수있다   O X 휠체어를 탄 장애인을 만나면 밀어주거나 도움을 줘야한다 O  X 이문제들도 풀어주실분,작성일2024.04.20,https://kin.naver.com/qna/detail.naver?d1id=6&dirId=6100102&docId=468393308&qb=7Zyg7LK07Ja0IOyepeyVoA==&enc=utf8
2024,2024.01.01. ~ 2024.12.31.,질문Itx수동휠체어석 예매,매진일때 수동휠체어석 예매하고 타도 되나요 저는 무조건 안된다고 알고있는데 어떤 사람들은 그렇게 타길래요 그거 안되는거 아니냐고 하면 어차피 시간되면 일반좌석이 된다나? 그러던데... 이게 괜찮은건가오? 사실 안되는거면 승무원들이 뭐라고할텐데 그렇지도 않은것같더라구요?,작성일2024.04.20,https://kin.naver.com/qna/detail.naver?d1id=8&dirId=81204&docId=468376442&qb=7Zyg7LK07Ja0IOyepeyVoA==&enc=utf8
2024,2024.01.01. ~ 2024.12.31.,질문요양병원 퇴원 후 요양보호사의 도움을 받으려면,"요양병원에 입원 중인데 퇴원 후 혼자 생활해야 하는데 막막합니다. 보행은 불가하고 휠체어로만 이동이 가능한 상황이고 장애등급은 예전에 4급을 받았는데요. 1, 퇴원 후 요양보호사의 도움을 받을 수 있나요? 2, 퇴원 후 요양보호사의 도움을 받으려면 어떻게 해야 하나요?",작성일2024.04.19,https://kin.naver.com/qna/detail.naver?d1id=6&dirId=61001&docId=468332210&qb=7Zyg7LK07Ja0IOyepeyVoA==&enc=utf8
2024,2024.01.01. ~ 2024.12.31.,질문장기요양등급 확인,"전동휠체어를 지원받아서 타십니다.. 그런데 수동휠체어도 받을수 있고, 보행기 하고 리프트도 받을 수 있다고 하더라고요 장기요양등급확인해서 받을수 있는거 조회하는 사이트가 있다고 하는데요 어디서 찾아서 등록 하고 볼 수 있나요?",작성일2024.04.17,https://kin.naver.com/qna/detail.naver?d1id=7&dirId=709&docId=468208085&qb=7Zyg7LK07Ja0IOyepeyVoA==&enc=utf8
2024,2024.01.01. ~ 2024.12.31.,질문제가 동구lh임대주택...,"제가 동구lh임대주택 월3만7천에 살고있는데 이사가려구요 집도좁고 여러가지 보일러터짐,도어락고장,전등떨어짐,곰팡이득실득실 등 으로 머리아파 계약끝나면 이사가려는데요. 기초수급자이고,무능력상태고,장애2급(전동휠체어탑니다)입니다 다시 lh아파트 남구쪽이나 서구쪽으로 알아보고 신청한다해도 오래걸릴것같아서요 그냥 서구쪽 이나 남구쪽 원룸 가려구요 주거급여가 얼마까지지원가능한가요?? 그리고 lh임대아파트나 영구임대 갈수있는방법 팁좀 알려주세요 여기서 벗어나고 싶네요 보증금은 700만원안으로 월세는 주거급여로 가능한곳으로요 아...글고 주택청약통장도있어요 3만원씩 1년넣은듯 해요 전 기관복지사가 개월수로 본다고해서 넣었어요",작성일2024.04.12,https://kin.naver.com/qna/detail.naver?d1id=6&dirId=6100102&docId=467921952&qb=7Zyg7LK07Ja0IOyepeyVoA==&enc=utf8
2024,2024.01.01. ~ 2024.12.31.,질문이상민 국회의원 왜 휠체어 타고 다니나요?,어디 아프나요?,작성일2024.04.12,https://kin.naver.com/qna/detail.naver?d1id=6&dirId=61402&docId=467902845&qb=7Zyg7LK07Ja0IOyepeyVoA==&enc=utf8
2024,2024.01.01. ~ 2024.12.31.,질문다리에 장애가 있는 여성입니다.,제가 막 못 걷는 장애는 아닌데 남들보다 느리고 조금만 오래 서 있어도 아프고 다리가 팅팅 부어서 장애 비스무리 있는 사람 입니다. 원래는 가장 낮은 장애 등급을 초등학생때 받았어야 했는데 장애등급이 생면 솔직하게 우리 나라가 장애등급이 있는 사람이 살기는 힘든 나라잖아요. 그래서 받지는 않고 살아가는 중입니다. 근데 제가 요번에 투모로우바이투게더 스텐딩에 당첨이 되었습니다. 너무나도 존경하고 좋아하는 아티스트라 너무 가고 싶습니다. 하지만 걱정되는것은 제 다리에 장애입니다. 휠체어 석을 할 수 있는 것도 아니고 오래 서 있으면 다리가 부어서 움직일 수 없는데 너무나도 가고 싶습니다. 민폐는 아닐까 가서 쓰러지면 어떡하지 걱정이 너무나도 됩니다. 저 같은 사람들이 오래 서 있을 수 있는 도구나 현실적으로 다른 방법 조언좀 부탁드립니다.,작성일2024.04.11,https://kin.naver.com/qna/detail.naver?d1id=7&dirId=70120&docId=467879912&qb=7Zyg7LK07Ja0IOyepeyVoA==&enc=utf8
2024,2024.01.01. ~ 2024.12.31.,질문노이 장애등급,휠체어를 타고다니는 노인장애 4급입니다. 갑작스럽게 한쪽눈이 실명되기도 했는데 3급으로 신청할수 있는가요?,작성일2024.04.11,https://kin.naver.com/qna/detail.naver?d1id=6&dirId=6100103&docId=467871097&qb=7Zyg7LK07Ja0IOyepeyVoA==&enc=utf8
2024,2024.01.01. ~ 2024.12.31.,질문장애인 연애와 결혼 도와주는 회사는 없나요?,"안녕하세요. 뇌병변을 가지고 있는 30살 장애인 남성입니다. 혹시 장애인에게 비장애인 혹은 장애인과의 연애나 결혼 도와주는 회사는 없나요? 일반적으로 잘 알려진 '결혼OOO' 같은 결혼정보회사나 소개팅 주선 회사는 제가 가입하려고 하면 은근히 막는 경향이 있더라구요. 물론 가입 자체는 되더라도, 주선이나 소개팅이 안들어오는 것을 포함해서요. 저는 다리가 좀 불편해서 휠체어를 탈뿐이지, 잡을 것이 있다면 걷기도 하고 패러글라이딩 같은 액티비티도 좋아하고 여행도 종종 다닙니다. 직업도 있구요. 하지만 이런 것들을 아무리 설명해 본들 뭘 하나요? 결혼정보회사나 데이트 주선 회사에서는 장애가 있다는 것만으로도 기피대상인가 봅니다. 이때까지 모쏠이다보니 자만추가 좀 어려운 것 같아서, 비용이 좀 들더라도...한번이라도 이성을 만나기라도 하고 싶은데 일반적인 소개팅 어플은 돈만 가져가고, 상대방이랑 카톡만 몇번 하다가 갑자기 상대방 연락 두절되고 그러네요. 소개해주실 만한 회사나 적절한 방법이 있을까요? 도와 주세요...!!!",작성일2024.04.10,https://kin.naver.com/qna/detail.naver?d1id=6&dirId=6100102&docId=467812925&qb=7Zyg7LK07Ja0IOyepeyVoA==&enc=utf8
2024,2024.01.01. ~ 2024.12.31.,질문산재치료중 장기요양등급 받을수있나요??,아빠가 산재치료 입원중이다가 곧 퇴원을 하게 되는데 휠체어 생활을 당분간 해야하는 상황입니다. 보호자의 도움을 받아 식사 및 배변을 해야하는 정도인데 산재 치료중인데 장기요양등급 신청이 가능한지 궁금합니다. 연세는 만나이 66세 입니다.,작성일2024.04.09,https://kin.naver.com/qna/detail.naver?d1id=6&dirId=6100403&docId=467759738&qb=7Zyg7LK07Ja0IOyepeyVoA==&enc=utf8
2024,2024.01.01. ~ 2024.12.31.,질문휠체어를 탄 장애인 식당 입장 거부,위 제목처럼 개인적 차원과 사회적 차원의 해결 방안으로 무엇이 있을까요 ?( 차별하지말기 이런거 말고 ㅜㅜ 조금 그럴듯 하게 알려주세요 ..!! 감사합니다),작성일2024.04.08,https://kin.naver.com/qna/detail.naver?d1id=6&dirId=6100102&docId=467704887&qb=7Zyg7LK07Ja0IOyepeyVoA==&enc=utf8
2024,2024.01.01. ~ 2024.12.31.,질문식당에서 휠체어를 탄 장애인을 거부한것도 인권침해인가요,식당에서 휠체어를 탄 장애인을 거부한것은 인권침해에 해당되나요? 맞다면 기본권 5가지중 어느것에 해당 되는지도 알려주시면 감사하겠습니다!,작성일2024.04.04,https://kin.naver.com/qna/detail.naver?d1id=6&dirId=61003&docId=467468805&qb=7Zyg7LK07Ja0IOyepeyVoA==&enc=utf8
2024,2024.01.01. ~ 2024.12.31.,질문사회 인권침해,어떤 사람이 장애가 있어서 휠체어를 타며 생활하는데 만약 선거일에 선거를 하러 갔지만 휠체어가 들어갈 수 있는 경사로가 없으면 이건 무슨 침해인가요? 평등권침해?참정권 침해??아님 뭔가요.. 그리고 어디서 구제받을 수 있나요? (예: 국민권익위원회 이런곳에서 구제받을 수 있다 이런거 알려주세요) 막 두개씩 골라서 알려주지 말고 딱 한가지 꼽아서 알려주세요!!,작성일2024.04.01,https://kin.naver.com/qna/detail.naver?d1id=6&dirId=61003&docId=467283761&qb=7Zyg7LK07Ja0IOyepeyVoA==&enc=utf8
2024,2024.01.01. ~ 2024.12.31.,질문휠체어 아파트 복도에 두면 소방법에 걸리나요?,거동이 불편하신분이 가끔 오시는데 휠체어를 복도에 두면 소방법 위반인가요? 저희복도 구조 입니다,작성일2024.04.01,https://kin.naver.com/qna/detail.naver?d1id=8&dirId=80902&docId=467277405&qb=7Zyg7LK07Ja0IOyepeyVoA==&enc=utf8
2024,2024.01.01. ~ 2024.12.31.,질문드라마 제목..,형제관계고 형이 휠체어 탄 장애인인데 (하반신 장애) 동생이 돌보는? 모르겠다…..,작성일2024.04.01,https://kin.naver.com/qna/detail.naver?d1id=3&dirId=3010101&docId=467261693&qb=7Zyg7LK07Ja0IOyepeyVoA==&enc=utf8
2024,2024.01.01. ~ 2024.12.31.,질문장애인주차구역 주차방해 통지서 의 질문입니다.,"안녕하세요 전 휠체어를 타고 1급 지체장애입니다. 또 키가 107입니다. 지하주차장에서 지상으로 차를 타고 올라와 화장실이 급해 5분 정차했습니다. 참지를 못해 바로 정차했습니다. 정차구역은 장애인 주차구역 선 앞에 했는데 주차방해로 벌금50만원이 나왔습니다 담당공무원에게 자초지정과 내가장애인인데 왜 벌금을 내는지 납득이 되지 않는다 하였고, 신고자에게 내상황을 설명하여도, 신고자는 취소를 하지 않는다 합니다. 담당공무원도 나의 상황과 이해를 해주며 50프로 감면해준다 하였습니다. 공무원들끼리 회의를 했다 합니다. 내가 화장실을 못참아 주차를 제대로 하지않고, 한것은 잘못된것은 맞지만.내가 장애인인데, 이법은 누구를 위한 법인지 허탈합니다. 내가 사는 아파트 단지내에서 이런일이 생기니 공허합니다 벌금은 바로 납부했지만, 당사자가 장애인인데 이것을 내야 하는 게 맞는건가요? #장애인주정차위반 #장애인주차 #주차방해",작성일2024.03.29,https://kin.naver.com/qna/detail.naver?d1id=8&dirId=8110302&docId=467101877&qb=7Zyg7LK07Ja0IOyepeyVoA==&enc=utf8
2024,2024.01.01. ~ 2024.12.31.,질문제가 MTF여성인데,"어릴때는 남자캐릭터만 그리고 칼, 총 좋아했는데 중학생되면서 여성스럽게 바뀌었어요. 제가 기형장애를 가진 여성이라고 생각합니다. 저의 큰키와 강한신체, 털도 기형으로인한 후유증으로 여기구요 근본적으로 성기기형을 가지고있고 이 성기기형때문에 신체가 비정상적으로 강한여성이라고 생각해요. 거울을 보면 제 얼굴도 여자처럼 이쁘장하고 저는 가슴과 골반이 있는데 왜 제가 남자인걸까요? 제가 머리가 짧고 남자옷을 입고 남자화장실과 남탕을 가는것도 기형장애때문에 그렇다고 여깁니다. 솔직히 남사친보다 여사친이랑 노는게 재밌고 제 진정한 친구는 전부 여자에요. 여자랑 코드랑 공감대가 맞구요. 저희 할아버지가 베트남전쟁 상해자라서 몸이 불편하시고 고등학교 교장선생님도 휠체어를 타시는 분이셨기때문에 전혀 장애는 부끄러운게 아니라고 생각해요. 성정체성장애일까요? 정신붕괴일까요?",작성일2024.03.27,https://kin.naver.com/qna/detail.naver?d1id=7&dirId=708&docId=466983586&qb=7Zyg7LK07Ja0IOyepeyVoA==&enc=utf8
2024,2024.01.01. ~ 2024.12.31.,질문보장구신청필요서류,어떤거있으면되나요? 보행이불편해서휠체어가필요해서요 지역은김포시입니다,끌올작성일2024.03.26,https://kin.naver.com/qna/detail.naver?d1id=12&dirId=12101907&docId=466804058&qb=7Zyg7LK07Ja0IOyepeyVoA==&enc=utf8
2024,2024.01.01. ~ 2024.12.31.,질문장애인차량 도용 유무,"제목 그대로 장애인차량을 도용한건지 아닌지 궁금해서 여쭤봅니다. 제 친구가 부모님이 주신 차를 타고 다니고 있습니다. 그런데 이 차가 장애인 등록차량인데 친구 부모님이 장애인이라서 그런건지는 잘 모르겠습니다. 또한, 장애인 스티커도 가리게 붙여놓고 장애인 주정차 구역에 차를 주차하고 있습니다. 찾아보니 장애인이 동승하지 않거나 휠체어 등과 같은 물건이 없으면 불법이라는데 맞는지 알려주세요",작성일2024.03.26,https://kin.naver.com/qna/detail.naver?d1id=6&dirId=602060401&docId=466895880&qb=7Zyg7LK07Ja0IOyepeyVoA==&enc=utf8
2024,2024.01.01. ~ 2024.12.31.,질문장애인등록 의료기기 할인혜택 문의,아버지가 양쪽다리 무릎위로 절단하게 되서 장애인등록신청했고 심사후 1~2달후에 등급나온다고하더라구요 곧 퇴원해서 집에서 생활하실듯한데 병원용 침대랑 휠체어같은거 준비해야하는데 지금은 등급이 나오기전이라 의료기상사에서 대여할예정이에요 나중에 휠체어나 병원용전동침대 구매하려고하는데 장애익 복지카드로 구매시 할인혜택이 있나요?? 아니면 장애인등록이미했고 추가로 장기요양등록 또해야하나요? 의료기기 침대 랑 의족 휠체어 요세가지정도 할인받을수있는 방법좀 알려주세요,작성일2024.03.25,https://kin.naver.com/qna/detail.naver?d1id=6&dirId=6100103&docId=466848046&qb=7Zyg7LK07Ja0IOyepeyVoA==&enc=utf8
2024,2024.01.01. ~ 2024.12.31.,질문부모님 모시고 남프랑스 쪽으로 여행을 가려고 합니다,"기간 : 5월 말 ~ 6월 초(1 ~ 2주 예상) 인원 : 4 - 5명 (조정 중) 여행지 : 남프랑스(1순위 예정), 혹은 유럽 쪽 고려 중입니다. 특이사항 : 아버지께서 거동이 불편하심. 5분 이상 걷기 힘들고 휠체어를 동반하여야 합니다. 어머니께서는 갑상선암 수술을 하셨어서 간이 강한 음식은 피해야 됩니다. 거동이 불편하진               않습니다. 질문사항 1. 1~ 2주의 여행기간 내에 남프랑스에서 꼭 가봐야할 곳이나 먹어봐야할 음식이 있다면 추천해주세요. 2. 장애를 가진 사람이 다니는데 불편함이 없을까요? 3. 유럽의 숙소 예약 방법을 잘 몰라서 팁을 주실 수 있을까요? 4. 이 모든 사항을 고려했을 때 남프랑스를 이외의 유럽 여행지도 추천해주실 수 있을까요?",작성일2024.03.24,https://kin.naver.com/qna/detail.naver?d1id=9&dirId=902&docId=466789790&qb=7Zyg7LK07Ja0IOyepeyVoA==&enc=utf8
2024,2024.01.01. ~ 2024.12.31.,질문자전거 탈수있나요(다시 질문이요),의사선생님께서 운동을 조금씩 말쓰하시고 제가 병원에서 장애등급 경증을 받았는데 아직은 걸을 수 있고 서있을 수도 있고 움직일수 있지만 움직이기 싫어서 휠체어만 타고다니다가 다리에 힘이 살짝 없어져서 이거를 고치기 위해 재활운동을 하면 자전거도 다시 탈수있나요?,작성일2024.03.20,https://kin.naver.com/qna/detail.naver?d1id=7&dirId=70120&docId=466572135&qb=7Zyg7LK07Ja0IOyepeyVoA==&enc=utf8
2024,2024.01.01. ~ 2024.12.31.,질문자전거 타고싶어요,제가 병원에서 장애등급 경증을 받았는데 아직은 걸을 수도 있고 서있을 수도 있고 움직일수 있는데 휠체어만 타고다니니까 다리에 힘이 살짝 없어져서 이거를 고칠려고 재활운동을 하면 자전거도 다시 탈수있나요?,작성일2024.03.20,https://kin.naver.com/qna/detail.naver?d1id=7&dirId=70106&docId=466570973&qb=7Zyg7LK07Ja0IOyepeyVoA==&enc=utf8
2024,2024.01.01. ~ 2024.12.31.,"질문요추4.5번 척추관협착증 수술후 절뚝거림,통증.장애판정","남편이 2020년 요추4.5번 척추관협착증 (후방감압술 및 척추유합술)을 수술 받았습니다. 수술전에는 통증이 심하지 않았는데, 수술받고 통증이 심해졌고, 다리도 절뚝거립니다. 재활부터 통증클리닉, 한방병원, 침술원까지 잘한다고 하는곳은 다 가봤는데 나아지지를 않네요. 5분이상 걷지도 못하고, 5분넘어가면 진땀을 흘립니다. 다리라도 꼬이면 중심을 못잡고 그냥 넘어지기가 다반사고, 무릅이 성할 날이 없네요. 뼈가 들어날 정도로 넘어져서 오는 모습을 보면 정말 안쓰러워 수술한것을 후회하는 날이 많습니다. 주차할곳이 없어 먼곳에 주차라도 하면 집에 들오올때까지 몇번을 쉬다 걷다 쉬다 걷다 합니다. 휠체어라도 사줘야 할것 같습니다. ㅠㅠㅠ 이럴때는 장애등급이라도 받을수 있으면 좋을텐데 남편이 수술한 경우는 장애등급을 받지 못한다고 하네요. 이점에서 너무 억울한건 메뉴얼 대로 하면 좌골신경통으로 수술한 경우 너무 잘걸어다니는데 , 하물며 뛰어 다니기도 하는데도 장애등급을 받았더라고요. 이건 형편에 너무 어긋난다고 생각이 드네요. 정작 아푼사람은 받지도 못하고 이런 경우 어찌해야할지 궁금하네요.",작성일2024.03.19,https://kin.naver.com/qna/detail.naver?d1id=7&dirId=709&docId=466497079&qb=7Zyg7LK07Ja0IOyepeyVoA==&enc=utf8
2024,2024.01.01. ~ 2024.12.31.,질문장애인 복지에 대하여,지체장애1급이고 기초생활수급자인데 휠체어를 사려고하는데 국가에서 얼마나 지원을 받을수있나요,작성일2024.03.17,https://kin.naver.com/qna/detail.naver?d1id=6&dirId=6100102&docId=466363344&qb=7Zyg7LK07Ja0IOyepeyVoA==&enc=utf8
2024,2024.01.01. ~ 2024.12.31.,질문벛꽃축제 여행 꽃축제 여행,"제가 경기도 남양주시 진접읍 광릉네 종점근처에 사는데요 사정 말하면 놀랄거에요 저는 김대준 1990년8월1일생되는 청년입니다 동생은 1991년 12월2일되는 청년입니다 우리는 부모님이없어요 고딩졸업후 부모님이 이혼하셨고 아버님이 우리를 돌봐주셨습니다 어머님은 어디서 뭐하는지 살았는지 죽었는지 알순없지만 우리랑 연락을 안합니다 찾을수도없고요 만일 운좋아서 찾는다해도 우릴만나주지 안을듯싶습니다 아버지는 다리를 걷지를 못하셔서 마비 증상 같은거 와서 휠체어를 타고다니는 분이셨어요 아버지가 술, 담배 진짜 좋아하셨지요 지금 작은집에 살지만 삼년전에 폐결핵인가 뭔병으로 아버지가 천국 가셨어요 ㅠ. ㅠ 이제 우리 도와줄분 나라밖에없어요 친척들 추석, 설날 아무날에도 안와요 연락 안되요 인연 끊겼어요, 생활보호대상자 등급이미 받았고 정신지체장애 등급도있고(형제둘다) 제칠일안식일 예수제림교 라고 있어요 교회 토요일가는 교회인데 어려운 가정이라고 많은 도움주고있어요 다행이에요 일주일간 반찬봉사 활동을 해서 반찬을 우리집 에 보내주세요 다행히또 나라에서 사회복지사분 오시라해서집에 그분이 필요한것 많이 도와주세요 우리를 위해서는요 저 김대준은 경기도 구리시 한양대병원에서 간질병있는데 그거 수술받은적도 있어요 지금은 이병이 어느정도는 완치가 될 때까지는 약을 꾸준히 먹어야한답니다 그렇다고요 태어나서 벛꽃축제도 그렇고 꽃축제도 그렇고 한번도 가본적이 없어요 나중에 이사가려면 돈도 모아야되고 여유도 그렇고 가까운거리에 꽃축제 한다면 봄에 동생이랑 손잡고 가고싶은데 어디 없을까요 비용 많이 안들면 더좋고요 전문가 분이라면 답장 확실히 말해주세요 안되면 어쩔수없고요 답변 기다리겠습니다 제발요 부탁드립니다 궁금합니다 진심으로 부탁드립니다 제발요 아무나 답변 기다리겠습니다 이상한글 쓰면 경찰에 신고 합니다 저는요 형사한테 고발할수도있고 파출소 순경한테도 신고합니다 빠른답변 부탁드립니다 제발요 ㅠ. ㅠ 또 제가 알기론 서울에선 4월9일에 한다던데 가까운 거리가 서울 석촌 이라던데 언제까지 가면 되나요? 궁금해서요 자세히 알려주세요 빠른답변 부탁드립니다 제발요 이상한 답변하면 화납니다 진짜안됩니다 꽃축제 꼭가보고싶어요 사진도 찍어보고싶고요 서울아니라도 좋아요 경기도 구리시면 더좋고요 알려주세요 날짜랑 시간이랑 다요",작성일2024.03.14,https://kin.naver.com/qna/detail.naver?d1id=9&dirId=901&docId=466227492&qb=7Zyg7LK07Ja0IOyepeyVoA==&enc=utf8
