연도,수집구간,제목,내용,날짜,링크
2020,2020.01.01. ~ 2020.12.31.,질문안녕하세요 저는 뇌병변 장애 2급 휠...,안녕하세요 저는 뇌병변 장애 2급 휠체어 타고 보행기 집고 다닐수 있는 환자입니다 제가 올해나 내년까지 잘 걸을 수 있는 운동법 치료법 있음 가르쳐 주심 사례할께요 또 저같은 경우 환자분으로 계셨다 나으셔서 이젠 잘 걸어다니시는 분 계시면 감사하게도 제가 희망을 가질수 있도록 알려주시고 어떻게 해서 나았다고 가르쳐주시면 진심으로 감사하겠습니다 전 왼다리 힘이 부족해서 지금 잘 못걷거든요 진짜 꼭 좀 도와주세요 제발 좀 부탁드립니다,작성일2020.09.13,https://kin.naver.com/qna/detail.naver?d1id=6&dirId=6100102&docId=367937570&qb=7Zyg7LK07Ja0IOyepeyVoA==&enc=utf8
2020,2020.01.01. ~ 2020.12.31.,질문수동휠체어처방전 어디가서 받을수있나요?,저희 시어머니가 장애5등급인데 편찮으셔서 휠체어를 구입하게 되었어요 휠체어 구입한곳에서 처방전 받아오면 10프로만 자기부담금이 있다고하는데 병원에서 때어주지않더라구요 어디가면 처방전받을수있을까요?,작성일2020.09.11,https://kin.naver.com/qna/detail.naver?d1id=6&dirId=6100102&docId=367799579&qb=7Zyg7LK07Ja0IOyepeyVoA==&enc=utf8
2020,2020.01.01. ~ 2020.12.31.,질문암 후유증인데 장애인 등급을 받을수 있나요?,안녕하세요 저희 언니는 2012년 뇌에 교모세포종이라는 암진단을 받고 어려운 치료과정을 거쳐 지금까지 살고 있습니다 하지만 치료 이후 후유증으로 인해 지금 현재 보행이 불편하여 거의 걷지 못하고 외출 시에는 휠체어에 의지하고 집 안에서는 U자형 보행기를 사용하고 있습니다 인지 능력과 판단 영역도 흐려져 일상생활을 하기에 지장이 조금씩 생기고 있습니다 현재 뇌 mri나 다른 검사 상으로는 이상 징후를 전혀 발견할 수가 없는데도 불구하고 보행 장애나 인지장애로 인해 많은 어려움을 겪고 있습니다 이런 경우에 어떻게 장애등급을 받을 수 있는지 또 장애등급을 받는 과정은 어떠한지 알고 싶습니다 행정 복지 센터에 의뢰를 한 결과는 저희 언니에게 해당되는 사항이 잘 없드라구요 답변 부탁드립니다 많이 답답합니다ㅠ.ㅠ,작성일2020.09.06,https://kin.naver.com/qna/detail.naver?d1id=7&dirId=70107&docId=367279648&qb=7Zyg7LK07Ja0IOyepeyVoA==&enc=utf8
2020,2020.01.01. ~ 2020.12.31.,질문부산 두리발 질문입니다.,지체장애 3급이시구요 이번이 골절로 다리 수술 받으셨는데 1주일정도뒤에 퇴원하려는데 두리발 이용할수있는 조건이 되나요? 휠체어 탄 상태에서 이동하려다보니 두리발 밖에 생각이 나지않더라구요. 답변 부탁드립니다.,작성일2020.09.06,https://kin.naver.com/qna/detail.naver?d1id=6&dirId=6100102&docId=367277105&qb=7Zyg7LK07Ja0IOyepeyVoA==&enc=utf8
2020,2020.01.01. ~ 2020.12.31.,질문척추협착증 디스크...,척추협착증 디스크가 있습니다 허리통증이 심해 신경차단술로 통증완화는 유지되고 있습니다 지금에 이르려 보행장해가 발생 대중교통 이용 불가하여 휠체어로 이동하고 있습니다 보행장애가 척추때문에 그런가요 아니면 뇌의 문제인가요 전문가 선생님의 세세한 말씀 기대하겠습니다 감사합니다,작성일2020.09.05,https://kin.naver.com/qna/detail.naver?d1id=7&dirId=70107&docId=367169101&qb=7Zyg7LK07Ja0IOyepeyVoA==&enc=utf8
2020,2020.01.01. ~ 2020.12.31.,질문꿈해몽 좀 해주세요,1.저희 언니가 실제로는 돌아가신 할아버지에요 근데 꿈에서는 살아계셨어요 휠체어를 타신 거 같기도 한데... 아무튼 할아버지하고 언니가 옆에는 차가 다니고 있는데 중간에 차가 안 다니는 길이 있었어요 그래샤 그 쪽으로 걸어간 거 같은데 계속 언니가 할아버지 사진을 찍었어요 그래서 엄마한테 보냈구요 근데 엄마가 사진을 왜 이렇게 많이 찍었냐고 약간 혼냈어요 2.제가 꿈에서 담배를 피고 있었어요 근데 언니하고 엄마가 와서 빨리 끄고 숨겼어요 그래서 잘 넘어갔는데 언니가 약간 의심하는 표정으로 바라봤어요 그러다가 제가 침대에 누웠는데 주머니에 넣어놨던 담배갑이 주머니 밖에 붙어있는거에요 그래서 당황해서 바로 주머니 안으로 넣었는데 언니가 본 거 같았어요 그래서 긴장하고있었는데 언니가 엄마한테 @@@이 담배피는 거 같다고 하는 장면이 보이는서에요 제가 직접 본 건 아니고 그냥 장면만 보였어요 그래서 계속 보는데 언니가 제가 담배를 폈던 장소가 여기라고 하고 엄마가 “그럼 @@@한테 바닥에서 이거 주웠는데 너 꺼야?” 이렇게 물어보자 어때 언니 그거말고ㅠ그냥 걔가 자주피는 곳에서 기다리자 엄마가 그래서 알겠다고 하고 엄마가 거기서 기다리고 있었어요 근데 점점 갈 수록 엄마가 수척해지고 담배를 피고 있었어요,작성일2020.09.03,https://kin.naver.com/qna/detail.naver?d1id=3&dirId=31505&docId=366994513&qb=7Zyg7LK07Ja0IOyepeyVoA==&enc=utf8
2020,2020.01.01. ~ 2020.12.31.,질문휠체어 타시는 어머니 장애인콜택시 탈 수 있나요?,"장애등급은 없구요. 요양등급은 받으셔서 일정시간 요양보호사의 돌봄 서비스를 받고 있습니다. 90세 고령이시고, 몇차례 척추수술로 자가보행은 어려우신 상황입미다. 외래진료를 위해 병원을 가셔야 하는 상황이라, 택시를 타는게 많이 불편합니다. 한동안 타다를 이용해서 병원을 다녔는데, 그마저도 어렵게되어 난감한 성황이구요. 택시의 경우, 휠체어를 흔쾌히 넣어주시는 기사님도 계시지만, 트렁크가 닫히지 않는 상황이라, 비가 먾이 내리던 올 여름에는 정말 최악이였지요. 서울에서, 보행이 어려운 분들을 위한 이동차량 혹시 있을까 해서 여뚸봅니다",작성일2020.08.30,https://kin.naver.com/qna/detail.naver?d1id=6&dirId=60101&docId=366631496&qb=7Zyg7LK07Ja0IOyepeyVoA==&enc=utf8
2020,2020.01.01. ~ 2020.12.31.,질문휠체어 보장구 문의요,혹시 전동스쿠터 보장구하고 전동휠체어 보장구 따로 처방진 받을수있나요???? 2가지는 못하나요??,작성일2020.08.30,https://kin.naver.com/qna/detail.naver?d1id=6&dirId=6100102&docId=366616278&qb=7Zyg7LK07Ja0IOyepeyVoA==&enc=utf8
2020,2020.01.01. ~ 2020.12.31.,2020년도 장애인보조기구(장애아동용 휠체어) 지원사업 신청 안내,,작성일2020.08.29,https://kin.naver.com/qna/detail.naver?d1id=6&dirId=60105&docId=366518639&qb=7Zyg7LK07Ja0IOyepeyVoA==&enc=utf8
2020,2020.01.01. ~ 2020.12.31.,질문재활병원아님귀농,아버지가 뇌출혈로 쓰러지셔서 수술을하셨고 지금 재활치료중이신데 후유중으로 선망증상과 우울증 불안증 등이 있습니다  육체적으로는 마비증상이 온곳은없고요.. 연세가 있으시다보니 재활은 더디고 병원에 있기싫어 난동을부릴때도있고 약도 잘않드실려구합니다..그러다보니 휠체어에 조금만부축해주면 혼자 타실수도있고 화장실을가도 혼자변기에 않는것정도는합니다 재활치료사말로는 보행기로 보호자가뒤에서 넘어지지않게 보조만해주면 혼자서도 걸을수있다고했구여 위에도 언급한듯 병원비에 간병비부담으로 재활병원으로 옮길려구하는데 재활병원입원한다고해도 아버지께서 거기있을려구하지않고 난동부리고 하면 강제퇴원조치될꺼같고 그러면 여기저기 옮겨다녀야하는데 그럼 비용도 버리고 시간도 버리고 할꺼같아요 그럴꺼면 차라리 제가 모시고 시골로 내려가서 공기좋은곳에서 요양한다셈치고 모시는건어떨지 만얀 모시고 시골로 내려간다면 무엇이 필요하고 어떻게 준비를 해야하는지좀 알려주세요 그리고 어느쪽이 좀더 나은선택인지 궁금합니다 .. 아버지 연세는 76세이시고 제나이는 40대입니다 아직 미혼이구요,작성일2020.08.28,https://kin.naver.com/qna/detail.naver?d1id=7&dirId=70120&docId=366436024&qb=7Zyg7LK07Ja0IOyepeyVoA==&enc=utf8
2020,2020.01.01. ~ 2020.12.31.,질문전동휠체어 보장구 처방...,전동휠체어 보장구 처방 전동휠체어 저가 지체장애1급이고 5년전에 보장구로 전동휠체어를 샀는데 저가 내년 10월달에 보장구가 나온는데 이번에 어떻게 해야하죠 절차 어케 바꿧는지 알려주세요,작성일2020.08.28,https://kin.naver.com/qna/detail.naver?d1id=6&dirId=6100102&docId=366427815&qb=7Zyg7LK07Ja0IOyepeyVoA==&enc=utf8
2020,2020.01.01. ~ 2020.12.31.,질문뇌출혈 후유증,"아빠가 약 3주 전쯤에 뇌출혈로 쓰러지시고 중환자실에 계시다가 피 양이 그렇게 많지 않다고 해서 수술 없이 재활병원으로 옮겼어요. 지금 왼쪽 편마비가 오셔가지구. 그리고 저번주까지는 밥 씹다가도 주무시고, 잠에서 헤어나오시질 못하셨는데 며칠 전부터 잠은 전보다는 많이 안주무시더라구요. 그래서 피가 점점 말라가나보다, 괜찮아지나보다 했는데 정신이 깨시니까 이제 헛소리를 중간중간 하시더라구요,, 간호사분한테 제 동생 이름으로 부르고, 갑자기 사촌 언니를 찾으시고, 오늘은 전 병원에 없는데 계속 제 이름 크게 부르면서 그러셨대요ㅠㅠ 처음 듣고는 잠을 하도 주무셨더니 꿈이랑 구분을 못하시나보다 했는데 저희 엄마 말씀으로는 괜찮다가도 오후 4시쯤만 되면 이러신다고 하더라구요. 특정시간만 되면 갑자기 이상한 소리를 하시는데 이것도 뇌출혈 후유증 중에 하나일까요?? 피가 말라가면서 부종이었나 그게 좀 커졌다는데 그거때문일까요? 괜찮아지시겠죠?ㅠㅠ 그리고 원래도 고집이 많긴 하셨는데 요즘들어 더 심해졌다고 하더라구요. 아직 움직이질 못하셔서 소변줄도 차고계시는데 계속 일어나신다고 그러고, 밥 드신 후에는 빨리 휠체어 가져오라고 담배필거라고 그러시고. 진짜 너무 속상해요ㅠㅠㅠ",작성일2020.08.24,https://kin.naver.com/qna/detail.naver?d1id=7&dirId=70107&docId=366086194&qb=7Zyg7LK07Ja0IOyepeyVoA==&enc=utf8
2020,2020.01.01. ~ 2020.12.31.,허리디스크로 주사치료를 받은 후에 오히려 더 통증이 심해졌습니다. (울산 50대초반/남 허리디스크),"1. 앉았다 일어나면 허리가 바로 펴지지 않고 엉거주춤한 자세로 좀 돌아다니다 보면 펴지고 2~30분 정도만 서있어도 왼쪽 반과 다리 감각이 이상해지고 아픈 증상이 한달정도 지속. 처음엔 증상이 심해서 설겆이를 하다가도 골반과 다리가 아파 누워서 쉬다가 하고 그랬는데 점점 좋아져서 완전 정상은 아니어도 일상생활이 가능. 2. 주변분이 디스크 수술을 하시면서 다리까지 증상이 있으면 빨리 병원가 가봐야 한다고 겁을 주셔서 병원 방문 MRI 촬영후 척추 4,5번 사이 디스크라고 주사맞고 귀가. 디스크라는 말에 경황이 없어 무슨 주사인지, 주사를 맞고나서 치료가 되는건지 몇회를 더 맞아야 하는건지 그런것도 묻지도 못하고 의사도 아무 설명없이 일단 주사 치료를 하고 경과를 보자며 왼쪽 허리에 주사치료. 설명서에는 척추미세신경치료술이라고 써있었습니다. 3. 월요일에 주사를 맞고 화요일까지는 허리와 골반이 약간 뻐근한것 같긴해도 앉았다 일어날때 허리도 바로펴지고 효과가 있는듯해 좋았는데 수요일부터 왼쪽골반과 허벅지가 쥐가 심하게 난것처럼 너무 아파 걷거나 서있는것이 불가능. 치료받은 병원에 문의하니 주사치료후 며칠간은 통증이 심해질수 있다고 일주일정도 경과를 보고 그래도 나아지지 않으면 내원하라고 안내. 4. 나아지려니 하며 기다렸는데 증상이 점점 심해져서 처음엔 서있거나 걸을때만 아프던것이 나중에는 앉아있거나 누워있어도 아프고 가만히 있는데도 통증이 너무 심해서 견딜수 없어 토요일 병원 방문. 그때는 증상이 너무 심해서 한발짝도 걷지 못하고 통증이 심해 휠체어 탐. 5. 병원에서는 지난번 치료는 일반적인 4,5번 디스크치료로 뒷쪽부분 주사했으나 본인의 증상은 5번 좌측 으로 튀어나온 신경에 문제가 있는것으로 추정. 의심부위에 다시 한번 주사후 효과가 바로 나타나면 진단이 맞으며 그 경우 효과가 오래 가지않고 바로 재발하며 치료방법은 수술밖에 없다함. 첫번째와 두번째 주사 모두 스테로이드 주사라고 함. 6. 다시 주사치료,시술시 골반과 다리쪽 통증이 너무 심해 참을성이 많음에도 엉엉 울정도임. 주사치료 후 누워있는데 통증이 전혀없고 약간 묵직한 느낌뿐. 의사가 본인의 진단이 맞으며 다시 통증이 오면 수술을 생각하고 오라고 함. 7. 주사치료 후 20~30분 후 귀가하는데 조금씩 아프기 시작. 골반과 허벅지 보다는 무릎과 정갱이가 조이는것처럼 아픔, 병원에 문의하니 주사후 며칠간 통증이 심해질수 있으니 기다려보라고 함. 8. 토요일 주사맞고 현재 수요일. 왼쪽 골반, 허벅지, 무릎, 정갱이 통증으로 잘 걷지 못하며 가만히 앉아있으면 무릎과 정갱이가 조이는듯 아프고 누워있으면 골반과 허벅지가 아프고 통증이 심해 잘 돌아눕지 못함. 9. 병원에 갈때는 거의 정상이었는데 주사를 맞을수록 없던 증상이 나타나고 통증이 너무 심해 주사 부작용이 아닌가 걱정되는데 해당 병원에서는 아니라고 하여 한방병원을 방문할까 생각중인데 한방치료로 개선이 가능한지 궁금함",작성일2020.08.24,https://kin.naver.com/qna/detail.naver?d1id=7&dirId=70301&docId=366060359&qb=7Zyg7LK07Ja0IOyepeyVoA==&enc=utf8
2020,2020.01.01. ~ 2020.12.31.,질문창원 휠체어 무료 대여,"장애인식 문화 개선 공모전을 준비하고 있는 한 학생입니다. 영상 소품으로 휠체어가 필요해서 혹시 창원에서 빌릴 수 있는 곳이 있을까해서 검색해봤는데 건강보험공단이라는 곳이 있더군요.하지만 빌리는 절차도 까다롭고 다리가 아파서 빌리는 것도 아니라서 빌릴 수 있을지 의문인 상황이네요. 첫째,건강보험공단에서 다리가 아프지 않은 사람도 공익을 목적으로하는 영상을 제작하기 위한 소품으로 휠체어를 빌릴 수 있을까요? 둘째,만약 빌리지 못한다면 다른데 구할 수 있는 곳이 있을까요? 만약 못 빌린다면 당장 자전거바퀴 때고 의자에다가 붙여야될판입니다.제발 도와주세요.",작성일2020.08.20,https://kin.naver.com/qna/detail.naver?d1id=12&dirId=121009&docId=365694121&qb=7Zyg7LK07Ja0IOyepeyVoA==&enc=utf8
2020,2020.01.01. ~ 2020.12.31.,질문척추유합술 후 어떤 운동을 하면 좋을까요?,"20년 가까이 척추측만증과 허리 디스크로 고생하다가 올해 6월말 척추유합술을 받았고 코로나에 취약한 다른 기저질환도 있어 요즘 코로나 확산으로 병원 내원한 재활 치료를 홈트를 하려는 40대 여성입니다. 5,6번 척추 사이 디스크 싹 긁어내고 핀을 6개 박았지만 수술 전에 비해 수술 직후부터 통증은 50% 줄었고(물론 살 짼 부위의 살은 아팠습니다 ㅋㅋ) 수술 다음날 휠체어 타고 머리 감으러 갈 정도로 경과는 좋았습니다. 수술 후 3일째부터는 무릎이 굽혀져서 침상을 잡고 스쿼트 했고 실밥 뽑자마자 수술한지 딱 일주일만 퇴원했어요. 어릴때 태권도랑 양궁도 했고 커서는 허리 통증이 심해지기 전에는 헬스도 했지만 최근3년간은 통증으로 하루에 실내싸이클만 15분씩 4세트씩 한게 다 입니다 퇴원후에도 심한 통증은 없어 처음엔 실내싸이클 5분씩 6세트씩 시작해서 현재는 종류도 늘리고 시간도 차츰 늘려서 하고 있어요) 1. 누워서 다리올렸다 천천히 내리기, 바닥에 척추 붙이기 , 누워서 허공에 싸이클 (매일) 2. 실내싸이클 30분씩 2~4세트 (주 3회 이상) 3. 스쿼트기계를 이용해 스쿼트 20개씩 10세트 (주 3회 이상) 코어운동을 더 하고 싶어서 오늘 케틀벨 20개, 플랭크 1분정도 시도 했는데 허리에 잠시 뻐근함만 느끼고 괜찮아져서 해도 되나 싶어서요. 제가 3급 뇌병변 지체장애인으로 선천적으로 다리에 장애가 있어 다리에 힘이 떨어지는 편이고 신경외과에선 무리하지말고 싸이클이나 어린이 수영장 정도의 수심에서 걷는 거나 스트레칭 정도를 권하셨고 주면에서더 너무 무리하면 핀 박은어 어그러질 수도 있다고 겁을 줘서 계속 제 페이스 대로 해도 되는지 고민입니다. 혹시 재활운동이나 안전한 자세로 할 수 있는 코어운동이 있다면 추천 부탁드려요.",작성일2020.08.19,https://kin.naver.com/qna/detail.naver?d1id=7&dirId=70120&docId=365600482&qb=7Zyg7LK07Ja0IOyepeyVoA==&enc=utf8
2020,2020.01.01. ~ 2020.12.31.,질문뇌출혈에 관한 질문,"2019년 6월. 컨디션이 좀 안 좋다 느껴져 샤워를 해야겠다 싶어 온수샤워를 해도 몸이 좀 이상하다싶었는데 전화통화를 하던 어머니께서 말이 어눌하다며 이상하다하여 덜컥 겁이 나 병원으로 바로 가던 중 더는 서 있기 힘들어 잠시 길바닥에 주저앉아 같이 병원으로 가던 와이프에게 병원으로 가 휠체어라도 좀 빌려오라고 해놓고선 기다리다 휠체어를 가져오던 와이프를 보고는 일어서려는데 도저히 일어서질 못하겠더라구요. 마침 병원 보안아저씨께서 같이 오셔서 휠체어에 일으켜 앉혀주셨구 휠체어에 타고 병원으로 가던 길부턴 기억을 잃었고 깨어보니 집중치료실이었 습니다. 다행히 집과 병원의 거리는 이삼백미터정도였어서 다행이었구요. 상세불명의 뇌출혈. 그에 의한 좌측 편마비. 수술은 안했고 피를 말리는 치료?? 이후 상태가 호전되어 재활치료를 다니는 중입니다. 입원당시의 영상촬영 사진에서의 피양은 컸는데 이제는 하얀점정도로 사라졌구요. 다만 꾸준한 재활로 지팡이나 목발이 없이도 엉성하긴 하지만 걷기도 하구요. 꼭 중풍 걸린 사람처럼 걷기는 합니다. 제가 궁금한건 평범한 보행으로의 회복이 가능한지와 의사는 간질의 가능성에 대해서도 얘길합니다. 겁이 많이 났구요. 아ㅡ 그리고 음주에 관한 질문. 평범한 44세의 남성인지라 아예 안 마시기는 힘들지 않을까 해서요. 물론 건강상 끊고 안 마셔야겠지만.... 나중에라도 마시게 된다면... 위험한건가요, 아니면 소량의 아주가끔의 음주는 가능한가요. 예를들면 아주 가끔은 와인 한두 잔 정도를 물어보는거예요. 친구들과의 소주나 위스키 한병이 아니구요. 식전 와인 한두 잔, 가끔 한번의 와인 한두잔 같은 거.",작성일2020.08.18,https://kin.naver.com/qna/detail.naver?d1id=7&dirId=70120&docId=365502627&qb=7Zyg7LK07Ja0IOyepeyVoA==&enc=utf8
2020,2020.01.01. ~ 2020.12.31.,질문급격한 다이어트 괜찮을까요? 정신과상담필요할까요?,26세 여성이에요... 약 3개월전까지 저는 170cm에 120kg 초고도비만녀였어요 다이어트해야겠다는마음은있었지만 먹는게좋고 사는게바쁘단핑계로 다이어트말만하고 시도도못했는데 어느날부터인지 눈도침침하고 심장이막힌듯한 답답함과 황달이나타나기시작했어요 피로한건 20년째 피로해서 그러려니 그냥넘겼던거죠... 주위에서 얼굴이너무안좋으니 병원에가보라고해서 병원에갔는데 피검사해보쟤요 검사했더니 간수치가너무높고 간이딱딱해지는 간경변 초기증상이라고 하시더라구요 그와 동시에 고지혈증도있지만 약처방은안하고 간장약만 처방해주셨어요.. 살못빼고 간이더안좋아지면 그대로죽는다고 지금이상태도 회복못하고 더나빠지는걸 늦추는약이라고하셨어요.. 그리고 집에오는길에 뚱뚱해서 있었던일들이 많이떠올랐고 작년겨울 발이아파 정형외과에가서 엑스레이찍고 짓누르는 무게때문에 족저근막염이 심하게왔고 30세가되면 못걷고 휠체어생활해야할꺼란 이야기가생각이났어요 아파지기시작하니 비참하더라구요... 나는 왜이렇게살고있을까 이렇게살아서 뭘할까 죽어버릴까 별생각을다하다가 살을빼보자 하고 마음을먹었어요 운동은발이아파못하니 먹는거부터조절을하자싶어서 밀가루부터끊고 설탕을끊고 과일을끊고 탄수화물을 85프로정도 끊었어요 그러자 끊기로한것외 아무거나 다먹어도 23키로가 빠지더라구요 운동없이 2개월하고 20일정도 동안 23키로가빠진거에요 주위에서 몰라보게달라졌다고 칭찬하고 노력하는딸이대견해져서 부모님은뿌듯해하고 저 자신도 자신감이생기더라구요 그런데 문제는 살빠짐에 욕심이나기시작하면서 모든음식을거부하고 무언가 한가지에 광적으로 집착하게됐어요 모든음식을거부하게된건 지금 16일정도 된것같은데 별로먹고싶은음식이 생각이안나다가 갑자기 김밥이 먹고싶다이런생각이듭니다 김밥을 사다주면 먹고싶은마음도사라지고 먹으려하면 헛구역질이나고 그나마 조금 먹고나서도 속이 꽉막힌듯한느낌이들고 하루종일 소화도안되는것같고 그럽니다 그나마 지금먹을수있는건 보리차밖에없어서 하루에 보리차를 1l정도 마시고있는것같아요 또 어쩌다 넘어가는거 방울토마토 네개 다섯개정도 그게하루에먹는게 다에요 그렇다보니 기운도없고 쓰러질것같이 머리가어지럽고 잠도못자고 16일못먹는동안 15키로가 또 빠졌습니다 부모님은 제가독하게다이어트하고있는줄알고 좋아하시는거 같아서 앞에서 쓰러질까봐걱정이됩니다 광적으로 집착을하는것은 청소에대한 집착을보입니다 음식거부하고나선 몸에난 털에대해 계속뽑고집착을보이다 갑자기 집안에있는먼지에 시선이 가고나선 매일매일 집안을 대청소하고있습니다 날도덥고 땀을 미친듯이흘리면서 벅벅 닦고있습니다 화장실바닥청소끝내고 일어서다 정신이아찔해서 넘어졌는데 온몸에멍이들고 넘어지고나서 넘어져서가아닌 다른이유로도 자꾸멍이생기는것같은데... 처음엔죽고싶었지만 이젠 정말죽을까봐 걱정이됩니다 피부가왜이러지 하다 2일정도뒤에 멍이 생깁니다 기운이 갑자기쭉빠져서 휴대폰을 놓치기도하고 정신이아찔하고 멍하기도하고 죽으면어떻게하지싶다가도 살이찔까봐두렵고 별별생각에 힘이듭니다 원래 이런이상한사람이아니였는데 제가왜이럴까요 정신과에가봐야할것같다고 스스로느끼면서 정신과에가서 약먹고 살이찌게될까봐 또걱정이됩니다 어떻게하죠?,작성일2020.08.16,https://kin.naver.com/qna/detail.naver?d1id=7&dirId=70109&docId=365403571&qb=7Zyg7LK07Ja0IOyepeyVoA==&enc=utf8
2020,2020.01.01. ~ 2020.12.31.,질문교회를 내가 정해야 하겠어요,1. 코로나로 마스크끼는 것을 지키는 교회 2. 헌금봉투 내용이 정확한 곳ㆍ십일조ㆍ감사헌금ㆍ생일 감사 헌금 이런식으로 정확히 있는곳 3. 나는 전광훈목사 사실 인정 안합니다ㆍ그리고 목사님이 정치에 관심이 있는 교회는 안가요 4. 하나님ㆍ예수님ㆍ성령님 성삼위일체외 관심이 없는 교회 5. 아직은 뇌졸중 5급이고 처음 장애 판정을 받을때 수급자도 받았어요. 그러나 지금은 걷는 운동할수 있는 교회 6.아직은 전동휠체어와 발에 뭘 차고 걸어 다닙니다 그래서 예배당이 1층에 있다 7. 내가 미성년자가 아닌 이상 스스로 교회를 갑니다. 이단이나 사이비 아니었으면 합니다 겉으로는 장로교ㆍ감리교 달면서 안에서는 사이비짓 하는 교회 많아요ㆍ아직은 아니 당장 내일 주일인데 안가도 됩니다 천천히 내가 정합니다. 8. 민주당지지 하는 교회 급한거 아니니 지금 이 시간부터 전화번호 광진구에 있는 교회?,작성일2020.08.16,https://kin.naver.com/qna/detail.naver?d1id=11&dirId=111004&docId=365350046&qb=7Zyg7LK07Ja0IOyepeyVoA==&enc=utf8
