연도,수집구간,제목,내용,날짜,링크
2025,2025.01.01. ~ 2025.12.31.,질문근육빠짐으로 망가진 몸 치료가 될까요?,11개월전 작은 골절 & 깁스 풀때쯤 어깨도 팔꿈치도 손도 망가지고건측 무릎 발목이 안 좋고 염증 생기고 치료받으면서 거의 5개월은 부동자세로 누워만 지냈더니 근육이 다 빠졌나봐요. 사실상 전보다 더 안 좋아서 지금도 많이 움직이지 못하고 있어요. 처음엔 체중 차이도 많이 없었고 깁스를 처음 해보고 오래 누워있어본적이 없어서 누워있음 근육이 빠르게 빠지고 단축되고 뻣뻣해지는줄 몰랐어요ㅠㅠ 깁스한 부분만 신경쓰면 되는지 알았거든요. 무튼 현재 상황은 많이 심각하고 복합적으로 많은 문제가 생겨서 어디서부터 해결해야 될지 너무 혼란스러워 조언을 구합니다. - 다치기전 과체중이긴 했지만 현재 10kg 체중이 빠졌다가 다시 찌는중( 전신 관절통 수면장애 그리고 심한 스트레스와 담적병으로 소화불량이 심해 많이 먹지도 못해서 급격하게 빠짐) - 전신 근육약화 & 단축 진짜 지방만 있는거 같음 인대 힘줄 근육들이 힘이 하나도 없고 단축되어 있거나 뭉쳐있는데 지방때문인지 폼롤러로 잘 굴러지지도 않고 풀어지지도 않음 두피까지 말랑텅이에 발바닥 손바닥도 말랑텅이에 엉덩이 근육은 아예 없음 힘도 안 들어감 그래서 코어도 안 잡힘 악력도 심하게 약함 아무리 허리를 바르게 세우려고 해도 안됨 근육에도 지방이 낀거같음ㅠㅠ 내부장기도 뭔가 아래로 쳐진거 같음 엉덩이 근육빠져서인지 골반쪽 근육은 매우 심각하게 불안한 상태임 누워서 혼자 코어힘으론 못 일어남 간신히 잡고 일어나는데 불안함 - 전신 관절불안정 거의 걷지도 못했고 활동을 안했더니 다 뚝딱소리에 통증 그리고 관절이 찝히거나 잡아주는 근육이 부실해서 뼈 정렬도 다 틀어짐 그냥 힘없이 뼈가 딸려감ㅠㅠ 척추측만증에 골반도 틀어지고 돌아가고 고관절도 많이 아프고 굳어있고 깁스한쪽은 근육 길이도 짧아지고 두께차이도 1.5cm남 엉덩이 근육이 다 빠지면서 진짜 적정 가동범위가 없어짐 막 뼈가 훌렁훌렁 힘없이 돌아감 - 소화불량(담적병) & 영양결핍 & 배뇨장애 겉으로 보기엔 먹을거 다 챙겨먹은애로 보이나 소화가 잘 안되어 계란2개 먹으면 이미 배가참 탄수화물은 거의 많이 먹지를 못하는데 억지로 골고루 먹으려고 노력중이나 영양흡수가 안되는지 몸이 갈수록 안 좋아짐. 제대로 먹지를 못하니 변비도 심하고 밀어내질 못함 괄약근도 약해진게 느껴짐 속근육도 약해져서 내부장기들이 늘어져서 쳐졌는지 방광이 눌리면서 소변이 자주 마렵고 요도 위치가 좀 아래쪽으로 내려온거 같음 - 심한 탈모와 피부 급속노화 스트레스와 영양결핍으로 탈모가 생겼음 머리카락은 영양분이 없어 가볍고 꾸불거리며 완전 실같이 가늘어 날리고 두피가 텅텅비어 삭발까지 하고 싶어짐 단백질 챙겨먹고 있는데도 담적병때메 영양흡수가 안되는지 뭉터기로 막 뽑힘 ㅠㅠ 두피에 근육도 약해졌는지 말랑거림 모근에 힘이 없어서 뽑히는거 같음. 30대인데 얼굴 근육도 빠져 살만 남아서 주름에 안색은 흑색임 - 보행장애 전체적으로 근육에 힘도 없고 체중은 많이 나가고 큰근육이 많이 약화되어 딱 서있을때 중심도 못 잡고 흔들흔들 잘못된 자세로 걷고 발바닥은 말랑이라 딛기만 하면 발바닥 뼈가 다 느껴지고 아픔 연속 10분이상 걷는것도 힘든 상태임 있는힘 쥐어짜내서 걷는데 날도 더워서 그런지 더 힘들어서 넘어질거 같음 어깨쪽부터 손도 안 좋아서 목발이나 지팡이 짚는것도 쉽지 않음 휠체어나 의자에 앉는것도 엉덩이뼈가 아프고 앉아있음 골반장기들이 압박을 받아 자꾸 빠져나올거 같은 느낌에 오래 앉는것도 불편 한 상태임 - 운동 4월부터 6월까지 일주일에 2번은 재활 필라테스 나가서 무리하지 않게 운동했는데 그동안 기력이 많이 떨어졌는지 몸이 힘들어서 7월부터는 잠시 쉬었더니 근육이 훅훅빠지는게 느껴짐 전에 됐던게 하나도 안되는 상태여서 앉아서 하는 유산소랑 밴드운동 많이는 못하고 조금씩 다시 하는중인데 너무 약하게 하는지 효과가 없는거 같음ㅠㅠ 근력이 갈수록 나빠지고 있음 - 스트레스 & 우울 관절통도 심하고 몸이 다 망가지고 제대로 먹지도 못하는데 근육이 없으니 살은 막찌고 여기서 더 줄이면 거의 안먹는거라 머리는 더 빠질거고 그나마 먹는것도 영양흡수가 안되는거 같고 배설도 불편하고 운동도 혼자서 하기엔 벅차고 아픈데 힘들어서 치료도 잘 못받고 자는것도 불편하고 변해버린 내 모습 받아들이기도 힘들고 살도 심각하게 말랑거리고 늘어지고 다시 되돌리기엔 너무 늦어버린건 아닌지 불안하고 슬프고 아직 젊은데 아직 못해본것도 많은데... 나도 모르게 눈물이 계속 남 고칠건 많은데 이미 힘이 다 떨어져서 몸도 마음도 다 지쳐있어요. 나빠지는 속도가 빨라서 얼마나 더 버틸수 있을지 모르겠어요. 이젠 전에 어찌 걸었는지 기억도 안나요. 혼자 흔들리지 않고 관절통증 없이 똑바로 서있기만 해도 좋겠어요. 전처럼 다시 잘 걸을수 있을까요? 영양결핍에 근육감소가 있지만 과체중이라 체중감량까지 생각해서 먹어야 하는데 식단 짜는것도 잘 모르겠고 전신 근육이 약해지고 불안정해서 운동도 조심해야하고 치료도 해야하는데 큰병원에 가면 도움을 받을 수 있을까요? 무슨과로 가야죠?ㅠㅠ 많은 답변 부탁드려요ㅠㅠ,작성일2025.08.02,https://kin.naver.com/qna/detail.naver?d1id=7&dirId=707&docId=487650664&qb=7Zyg7LK07Ja0IOyepeyVoA==&enc=utf8
2025,2025.01.01. ~ 2025.12.31.,장애인 과잉진압 사건과 공무집행방해죄의 성립 여부,"안녕하세요 저는 지체장애1급과 지적장애3급을 가지 중복장애인입니다 도로에서 경찰관3명에게 양쪽팔이 잡혔습니다 그리고 앞으로 끓려가다가 휠체어에서 넘어지고 휠체어랑 분리가되어있는 상태에서 저항을 하였습니다 경찰3명이 양쪽팔을 잡고 저를 누르면 진압을 하여 살려고 저항을 하였습니다 근데 경찰이 넘어지고 제 팔에 맞아서 안경이 부서졌다 수리까지 했다고 하고 저는 현행법으로 체포가 되었습니다 뒤수갑차고 30분이상을 휠체어없이 끓려다였습니다 폴목과 절단이된 다리에 멍이 들어서 상해 진단서도 있는 상태이고 같은 지구대 팀장은 제가 업어치기를했다고 하고요 주먹을 폭행을한 영상이.있다고 하고요 근데 저는 양쪽팔이 잡힌상태이고 휠체어랑 분리가 된상황입니다 경찰이 맞았다고 하여 저를 공무집행방해죄  송치가 되어 법원에 심판을 기다리고 있습니다 저항중 폭행이 있었다고하면 이것이 공무집행방해죄 가 성립이 되는지 이사건을 과잉진압으로 무죄로 나가는게 맞는건지 헷갈림니다 과잉진압이 너무 까다롭고 해서요 정당방위라는 법도 보면 까다롭고 해서요 이내용만 보았을때 보고 도와주세요 관련태그: 수사/체포/구속 , 폭행/협박/상해 일반",작성일2025.08.01,https://kin.naver.com/qna/detail.naver?d1id=6&dirId=60215&docId=487619170&qb=7Zyg7LK07Ja0IOyepeyVoA==&enc=utf8
2025,2025.01.01. ~ 2025.12.31.,질문전동휠체어,잔동휠체어타고 비행기 탈수 이ㅆ나요? 약관 장애가 있어요.,작성일2025.07.30,https://kin.naver.com/qna/detail.naver?d1id=9&dirId=90207&docId=487581486&qb=7Zyg7LK07Ja0IOyepeyVoA==&enc=utf8
2025,2025.01.01. ~ 2025.12.31.,질문할머니가 요양원에 계시는데 장애등급,받을 수 있나요? 걷지도 못하고 휠체어에 앉아계세요,작성일2025.07.28,https://kin.naver.com/qna/detail.naver?d1id=6&dirId=6100102&docId=487510946&qb=7Zyg7LK07Ja0IOyepeyVoA==&enc=utf8
2025,2025.01.01. ~ 2025.12.31.,질문장애인 근로지원인에 대해,"안녕하세요 근로지원인으로 일한지 1년 반 넘었는데요 지금까지 제가 겪었던 일에 대해서 여러분들께서 생각을 좀 알고 싶습니다 사실 이게 내가 일하는거 맞나?? 라는 생각을 자주 들 정도로 그렇습니다. 일단 제가 겪었던 일들을 뭐 때문에 근로지원인들이 왜 그만두게 되는지 알려드릴게요 솔직히 근로지원인들이 왜 그만두게 되는지 알고싶거든요. (참고로 장애인 근로자의 장애 유형은 소화마비, 근로지원인(본인)은 언어장애입니다) 1. 근로지원인인데 내가 다 업무를 하는것 - 말 그대로 장애인 근로자의 '보조'인데 장애인 근로자 대신 제가 다 하고 있는것 어떤 업무냐, 휠체어를 대여, 납품, 회수할 때 트렁크를 실은거를 제가 다 해야 한다는것 마치 택배 물류팀+기사+운반인력이 되어버린 느낌. 실제로 무거운 휠체어를 자주 드니까 허리, 발, 다리, 팔, 손, 손목이 아프니까 가끔 병원을 간적이 있음 2. 업무 스타일이 너무 다름 - 장애인 근로자의 직급이 부장님이라 목소리가 작게 나오니까 잘 안들려서 시키는대로 했는데 아니라고 하니까 짜증을 냄. 휠체어 수리 중에 꼭 눈치를 줘야 함. 보통은 협업인데 말을 해야 내가 뭐 해야 하는지 알아 듣는데 눈치를 줘야 하기 때문에 스트레스 받음 3. 커피, 담배, 로또를 사오라고 함 - 커피까지는 이해하겠는데 담배랑 로또를 사오라고 하니까 내가 왜 이런거를 사야하지 라는 생각을 많이 듬 제가 술담배를 너무 싫어하는데 운전중에 전자담배를 피니까 결국 간접흡연을 받게 됨. 또 운전중에 전자담배 무슨 필터가 있는데 나보고 필터를 갈아라 라고 함 담배를 싫어하는사람한테 그거를 시키니까 어쩔수 없이 하게됨 4. 하루종일 감정노동임 - 하루 중 단 한순간도 내 감정에 집중할 수 없고, 항상 상대의 기분을 맞춰야 함 5. 시급인데 정규직처럼 일함 - 밖에 덥고, 추우면 힘들고, 몸이 아프고, 업무들을 내가 싹 다 하니까 급여가 항상 180만 받으니까 도저히 할 수가 없음 6. 장애인 근로자가 아이스 하키를 운동하시는데 선수들이 없다고 날 선수등록을 해버림. 한다고 한적이 없는데 결국 울며 겨자먹기로 하고 있음 이게 제가 지금까지 겪었던 일들인데요 여러분들은 근로지원인에 대해 어떤 생각 드는지 알고싶습니다",작성일2025.07.26,https://kin.naver.com/qna/detail.naver?d1id=6&dirId=6100102&docId=487450365&qb=7Zyg7LK07Ja0IOyepeyVoA==&enc=utf8
2025,2025.01.01. ~ 2025.12.31.,질문초3 여학생 고민 있는데요,저희 아파트 옆집이 친구네 집인데요. 친구문제로 고민이 있습니다. 친구는 다리에 장애가 있어서 늘 휠체어를 타는 친구입니다. 그래서 등하교시 제가 매일 챙겨주고 도와주는 친구입니다. 지금은 방학했지만 학교다닐 때는 장애있는 친구를 괴롭히는 애들이 있는데 담임선생님께도 알렸지만 서로 사과하라고 하며 대충 마무리 지으셨습니다. 다리ㅂㅅ이라고 하는 애들도 있고 휠체어에서 밀어버리기도 하고 제가 본 것이 있는데 선생님들은 믿어주지 않고 넘기려고만 하는데 제가 친구를 어떻게 도와야 할까요? 다리만 불편할 뿐 공부도 찬하고 착한 친구입니다. 제가 유치원때부터 친했던 친구여서 잘 알고 있습니다. 친구엄마랑 저희엄마랑 친구사이 이신데 일단 저희 엄마에게 알려야 할까요? 저는 어떻게든 친구를 돕고 싶은데 방법이 없네요,작성일2025.07.26,https://kin.naver.com/qna/detail.naver?d1id=8&dirId=8010501&docId=487447652&qb=7Zyg7LK07Ja0IOyepeyVoA==&enc=utf8
2025,2025.01.01. ~ 2025.12.31.,질문제발 영상좀 찾아주세요ㅠㅠㅠ,한 2010년대 장애 이해교육 영상 같은건데 주인공이 장애인인데 학생이고 주요인물이 엄마랑 잘생긴 인싸 친구 이렇게 나오는데 말하기 버거워하고 휠체어를 탔어요 기억나는 내용은 주인공이 엄마 직장에 가서 물 머르려다가 물을 엎었고 그리고 그 친구랑 어디 놀러갔다가 시비 털려서 친구가 대신 싸워주는고 주인공이 관찰만하고 슬퍼하고 주인공이 재호ㅓㄹ치료 열심히 해서 마지막에 축구공을 차요 이 영상 뭔지 제발 알려주세요ㅠㅠㅠ,작성일2025.07.25,https://kin.naver.com/qna/detail.naver?d1id=7&dirId=707&docId=487407880&qb=7Zyg7LK07Ja0IOyepeyVoA==&enc=utf8
2025,2025.01.01. ~ 2025.12.31.,"질문발목 수술 후 요추 통증 및 다리 떨림 증상, 재활 기","안녕하세요. 3개월 전 발목 수술을 받고 현재 포천병원에 입원 중입니다. 발목 통증은 거의 사라졌지만, 왼다리를 장기간 지탱하면서 사용한 영향 때문인지 최근 허리(요추 부위) 통증이 매우 심해졌습니다. 처음에는 단순한 근육통으로 생각했지만, 현재는 다리가 욱씬거리는 통증과 함께 떨림 증상까지 발생하고, 누워 있거나 앉아 있어도 통증이 계속됩니다. 특히 다리 통증과 떨림 때문에 허리를 아예 펼 수 없는 상태이며, 일어설 때도 정상적인 자세를 취하기 어렵습니다. 현재는 휠체어를 사용 중입니다. 이러한 증상이 단순한 과사용에 의한 것인지, 혹은 신경계 이상이나 다른 문제가 의심되는지 궁금합니다. 또한 이 상태에서의 재활 치료 방향과 예상되는 치료 기간에 대한 조언을 부탁드립니다.",작성일2025.07.18,https://kin.naver.com/qna/detail.naver?d1id=7&dirId=70120&docId=487200021&qb=7Zyg7LK07Ja0IOyepeyVoA==&enc=utf8
2025,2025.01.01. ~ 2025.12.31.,질문엄마께서 철심 박으셨는데 지체쪽으로 장애등급이 될까요?,엄마가 24년도에 왼쪽 발목을 다치셨는데 하필이면 몸이 안좋으신데 연골이 녹아내리셔서 발목에 철심을 꽂으셨는데 1차병원에서 관리를 못해줘서 철심이 발등을 뚫어버려서 대학교병원에서는 다시 임시수술했는데 의사선생님께서 그냥 자르자고 말씀하시는데 엄마께서 처음으로 안된다고 말하시면서 펑펑 우시고 아빠도 아직 1년도 안되었는데 조금더 지켜보고 자르자고하셔서 의사선생님께서 그럼 수술 몇번하자해서 5번이나 대수술하시고 마지막인 5번째에는 발목을 지탱해줄 철심을 박으시고 못도 6개정도 박으시고 리바운드 에어워커를 차고계시는데 병원에서는 다신 못 걸은다고 말하고 철심을 평생 못뺀다고 말했습니다. 그래서 장애 신청을 하신다고하시는데 신청이 될까요? 지체쪽으로 신청해야되는걸로 아는데...처음 진단서에는 사콧관절병증이라고 적어주셨는데.. 다리를 못쓰시고 휠체어타신지 8개월이 넘어가고 있습니다.,작성일2025.07.17,https://kin.naver.com/qna/detail.naver?d1id=7&dirId=70106&docId=487176101&qb=7Zyg7LK07Ja0IOyepeyVoA==&enc=utf8
2025,2025.01.01. ~ 2025.12.31.,질문부산 서면 cgv 청소년 장애인석에 가도 될까요?,제가 쓸개골 탈구로 인해 수술을 받아서 8주이상 통깁스를 해야하거든요. 걷는게 거의 불가능한 상태라 거상(무릎을 완전히 피고있는)휠체어를 사용중인데 휠체어석 이용이 가능할까요? 그리고 부모님 한분이랑 동행할려고 하는데 부모님은 따로 좌석을 구해야할까요?,작성일2025.07.17,https://kin.naver.com/qna/detail.naver?d1id=6&dirId=6100102&docId=487171217&qb=7Zyg7LK07Ja0IOyepeyVoA==&enc=utf8
2025,2025.01.01. ~ 2025.12.31.,질문내일 병원에서 장애인전형 면접있는데 뭐를 준비하고 가면,안녕하세요~ 저는 39살 조현병환우입니다 최근에 장애인 등급을 받고 병원에 휠체어 정리하고 진료안내하고 기구를 소독하는 일 등을 하루에 4시간 도와주는 일에 지원했고 내일 면접을 앞두고 있습니다 가서 어떤 내용을 미리 준비하고 가면 도움이 될까요? 자기소개서에는 제가 대학교 때 외국어를 전공했으며 아픈 후 돌보미 직종에 관심이 가서 간호조무사 자격증을 땄고 그래서 산부인과에서도 일한 경력이 있었지만 증상관리를 잘 하지 못해 짤렸다고 적어두었습니다 제가 언제 아팠는지 어떻게 증상을 관리했는지 최근 증상이 어느정도 호전되었는지 이 정도 준비해가면 될까요? 조언해주시면 감사하겠습니다,작성일2025.07.16,https://kin.naver.com/qna/detail.naver?d1id=6&dirId=6100102&docId=487150248&qb=7Zyg7LK07Ja0IOyepeyVoA==&enc=utf8
2025,2025.01.01. ~ 2025.12.31.,질문하반신마비 휠체어 장애인은 보통 바지를 어떻게 입나요,"척수염으로 하반신에 문제가 생겨 휠체어 이용중인 장애인 입니다. 바지 입을때 여간 힘든게 아닌데, 어떤 팁(노하우) 있으면 알려주세요~제발",작성일2025.07.10,https://kin.naver.com/qna/detail.naver?d1id=6&dirId=6100102&docId=486970832&qb=7Zyg7LK07Ja0IOyepeyVoA==&enc=utf8
2025,2025.01.01. ~ 2025.12.31.,질문장애인 휠체어가 발 위로 지나갔는데 보상받아야 하나요,엑스레이상 큰뼈 이상없고 실금이나 근육이 다쳤을수 있으나 기부스 불가능 부분이라네요. 다음주 다시 엑스레이 찍기로 했는데 가해자 연락처는 알아요,작성일2025.07.08,https://kin.naver.com/qna/detail.naver?d1id=8&dirId=80101&docId=486908751&qb=7Zyg7LK07Ja0IOyepeyVoA==&enc=utf8
2025,2025.01.01. ~ 2025.12.31.,질문장애인주차장,아파트 장애인 주차장 자리에 4명이 돌아가면서 주차를 하는데 다 장애인 스티커는 있지만 단 한 번도 몸이 불편하신 분이 함께 타고 내린 걸 본 적이 없습니다. 다 잘 걷고 뛰어 다니시네요..겉으로 안 보이는 장애일 수도 있지만 장애인 주차자리가 그렇게 넓은 건 휠체어를 타고 다니시는 분들이 타고 내리기 위해서라고 생각합니다. 이건 신고가 안 되나요? 이분들 때문에 정말 몸이 불편한 장애인분이 멀리 차를 대고 집에 가시는 게 자꾸 보여서요..,작성일2025.07.02,https://kin.naver.com/qna/detail.naver?d1id=6&dirId=60102&docId=486738141&qb=7Zyg7LK07Ja0IOyepeyVoA==&enc=utf8
2025,2025.01.01. ~ 2025.12.31.,"질문야구예매, 휠체어석 일반경증 장애인 예매가능?",제목그대로 야구 예매할때 보면 장애인은 휠체어석 장애인으로 되어있는데 휠체어를 이용하지 않는 경증장애인은 예매불가한가요?? 내용을 홈페이지에 찾아봐도 나오지 않아서요 답변감사합니다.,작성일2025.06.30,https://kin.naver.com/qna/detail.naver?d1id=10&dirId=10010202&docId=486653624&qb=7Zyg7LK07Ja0IOyepeyVoA==&enc=utf8
2025,2025.01.01. ~ 2025.12.31.,질문휠체어 필요없는 퇴원쇼,김건희 분명 휠체어타고 퇴원 했는데 자택에서 유유히 걸어다니는게 더팩트 기자에게 발각 됐는데 이게 어떻게 된거요,작성일2025.06.28,https://kin.naver.com/qna/detail.naver?d1id=6&dirId=61303&docId=486595091&qb=7Zyg7LK07Ja0IOyepeyVoA==&enc=utf8
2025,2025.01.01. ~ 2025.12.31.,질문10대뇌출혈,17세 여자고. 갑자기 뇌출혈로 쓰러져 응급실 가서 검사한후 수술했고. 2주정도 중환자실에서 위험고비와 함께 의식불명 상태였지만. 3주차에 깨어났고. 거의 편마비라서. 왼쪽은 거의 사용하지 못하는 상태고 교수님은. 재활치료 해보고 경과 지켜보고 말씀 다시드리고 영구장애로 남을수도 있다는데. 그럼 평생 휠체어를 타고 다녀야 하나요?,작성일2025.06.27,https://kin.naver.com/qna/detail.naver?d1id=7&dirId=70107&docId=486575157&qb=7Zyg7LK07Ja0IOyepeyVoA==&enc=utf8
2025,2025.01.01. ~ 2025.12.31.,질문보건소 휠체어 단순 인대 파열로 대여 가능한가요?,오른쪽 발목 인대가 파열됐는데 이번에 왼쪽을 접지르는 바람에 인대가 부어서요. 움직이는 게 너무 힘들어서 그런데 주민센터에 연락해보니 다 나갔다고 하더군요ㅠ 거리가 꽤 있는 곳에 보건소가 있긴한데 장애인 판정을 받아야 사용 가능하다는 말이 있더라고요 혹시 저처럼 단순 발목 인대 염좌여도 휠체어 대여가 가능할까요?,작성일2025.06.27,https://kin.naver.com/qna/detail.naver?d1id=7&dirId=70106&docId=486573822&qb=7Zyg7LK07Ja0IOyepeyVoA==&enc=utf8
2025,2025.01.01. ~ 2025.12.31.,질문벌레가 나오는 공포영화 제목을 찾고싶습니다.,기억나는장면이  초반에 경비원 같은사람이 화장실에 들어가서 볼일을 보는도중 갑자기 무언가에 끌려가면서 시작하고 정확하지는 않지만 배? 같은곳에서막 사람들이 피난하는 와중에 휠체어를 탄 등장인물도  나왔던걸로 기억합니다..,작성일2025.06.27,https://kin.naver.com/qna/detail.naver?d1id=3&dirId=30305&docId=486569795&qb=7Zyg7LK07Ja0IOyepeyVoA==&enc=utf8
2025,2025.01.01. ~ 2025.12.31.,질문외국 영화 찾아요,여주인공 이름은 로즈고 남주 이름은 기억안나는데 장애가 있어서 휠체어 타는데 엄청 부자임. 남주 엄마가 남주를 위해 여주를 고용하는건데 면접 때 여주 치마 옆쪽이 뜯어져요 근데 남편(남주아빠)? 가 로즈랑 인사할때 뜯어진 부분 허벅지를 가리는 모습을 남주엄마가 보고 보수적인 모습이 맘에들어 고용함. 남주는 좀 까칠고 뭐 그런 느낌인데 여주는 돈을 벌어야하니까 열심히하는데 뭐 옷 웃기게입기? 뭐 그런거? 남주 즐겁게해주기가 고용내용이었나? 암튼 남주는 차차 마음을 열어가고 둘이서 연주회 가는데 거기서 남주는 여주만 보고.. 뭐 이런 내용인데 제목 알 수 있을까요?,작성일2025.06.14,https://kin.naver.com/qna/detail.naver?d1id=3&dirId=30302&docId=486169896&qb=7Zyg7LK07Ja0IOyepeyVoA==&enc=utf8
2025,2025.01.01. ~ 2025.12.31.,질문무한도전 질문,무한도전에서 비탈길(휠체어 타는 분들 건물 내에서 올라가게 해주는 것을 의미) 을 계단인양 멤버들이 움직이는 편이 뭐였죠?,작성일2025.06.11,https://kin.naver.com/qna/detail.naver?d1id=3&dirId=3010203&docId=486075692&qb=7Zyg7LK07Ja0IOyepeyVoA==&enc=utf8
2025,2025.01.01. ~ 2025.12.31.,질문중증장애인 기초수급자 기아 K5,중증장애인 기초수급자 1인이고 스포츠 선수 직장이 있음 휠체어땜에 이동불편함 k5 시그너지 풀옵션 신차를 살건데 장애인할인되고 보조금되나요? 여기 전주데 얼마인지 알수있을깡?,작성일2025.06.11,https://kin.naver.com/qna/detail.naver?d1id=6&dirId=6100102&docId=486056532&qb=7Zyg7LK07Ja0IOyepeyVoA==&enc=utf8
2025,2025.01.01. ~ 2025.12.31.,질문장애인아닌데 다쳤을때 장애인 주차구역에 차댈경우..,동승자가 다쳐서 휠체어로 이동해야경우... 장애인 주차구역에 차를 대면 불법인가요? 이런 경우 등록 장애인 아니라도 봐주나요?,작성일2025.06.10,https://kin.naver.com/qna/detail.naver?d1id=6&dirId=6100102&docId=486033799&qb=7Zyg7LK07Ja0IOyepeyVoA==&enc=utf8
2025,2025.01.01. ~ 2025.12.31.,다리 감각 상실+우울증을 가진 어머니(전주 중풍후유증),전주 60대 후반/여 중풍후유증 어머니가 풍으로 쓰러지셨다가 얼마 전에 겨우 퇴원하셨는데 다리가 여전히 감각이 없고 걷기가 힘드셔서 휠체어를 끌고 다니시거나 목발을 짚고 다니십니다. 이런 변화 때문에 그런지 우울증 증상도 생기신 것 같은데 어떻게 해야 낫나요?,작성일2025.06.10,https://kin.naver.com/qna/detail.naver?d1id=7&dirId=70305&docId=493313821&qb=7Zyg7LK07Ja0IOyepeyVoA==&enc=utf8
2025,2025.01.01. ~ 2025.12.31.,질문휠체어 추천,휠체어 추천 지금 임대료 월3만원에 사용하고 있는데 하나 사는게 좋을듯하네요. 현재 서지를 못해서 휠체어타고  앉아서 걷기운동도 할 수 있는 휠체어  추천 바랍니다.,작성일2025.06.07,https://kin.naver.com/qna/detail.naver?d1id=5&dirId=50802&docId=485938214&qb=7Zyg7LK07Ja0IOyepeyVoA==&enc=utf8
2025,2025.01.01. ~ 2025.12.31.,질문기초수급자 테슬라 전기차인 자동차문의,저 중증장애 수급자 1인이지만 스포츠 선수인 직장을 다니고 있어요 휠체어땜에 이동 불편해서 차를 사려고 합니다 테슬라 모델3 하이랜드를 원하는거든 장애인할인하고 보조금도 포함 총 5000만일 것같은데 사도 괜찮을까요? 차를 사면 수급자 유지될까요? 탈락되지않죠?  궁금합니다..,작성일2025.06.07,https://kin.naver.com/qna/detail.naver?d1id=6&dirId=6100101&docId=485930964&qb=7Zyg7LK07Ja0IOyepeyVoA==&enc=utf8
